id,title,price,rating,color
1,2020 Summer Vintage Flamingo Print  Pajamas Set Casual Loose T Shirt Top And Elastic Shorts Women Sleepwear Night Wear Loungewear Sets,16.0,3.76,white
2,SSHOUSE Summer Casual Sleeveless Soirée Party Soirée sans manches Vêtements de plage sexy Mini robe femme wshC1612242400387A21,8.0,3.45,green
3,2020 Nouvelle Arrivée Femmes Printemps et Été Plage Porter Longue Mince Cardigan Ouvert Avant Kimono Vert Feuille Imprimé En Mousseline de Soie Cardigan S-5XL,8.0,3.57,leopardprint
4,Hot Summer Cool T-shirt pour les femmes Mode Tops Abeille Lettres imprimées Manches courtes O Neck Coton T-shirts Tops Tee Vêtements,8.0,4.03,black
5,"Femmes Shorts d'été à lacets taille élastique lâche mince pantalon décontracté, plus la taille S-8XL",2.72,3.1,yellow
6,Plus la taille d'été femmes décontracté sans manches barboteuses combinaisons combinaison de couleur unie jarretelles pantalons lâche salopette,3.92,5.0,navyblue
7,Women Fashion Loose Lace Blouse Blouse V Neck Bat Sleeves T Shirt Hollow Out Tops Plus Grande Taille XS-8XL,7.0,3.84,white
8,Robe tunique ample femme Robe d'été Robe en jean Robe chemise en jean Robe droite,12.0,3.76,blue
9,Robe d'été décontractée à manches courtes pour femmes,11.0,3.47,black
10,"Femmes d'été, plus la taille décontractée lâche col en V à manches courtes imprimé floral Blouse Tops",5.78,3.6,beige
11,Femmes Mode Été Lâche Sans Manches Poches Couleur Unie Maxi Dress Robe Décontractée Plus La Taille,5.79,3.46,grey
12,Été Sexy Femmes Mode Casual Lâche Tops Casual T-Shirt D'été Col En V Solide Couleur Plus La Taille À Manches Courtes Blouse,6.0,3.31,lightblue
13,Shorts de causalité d'été de nouvelles femmes Pantalon court à cordon Pantalon court lâche,1.91,3.45,orange
14,"Mode féminine sans manches col profond croix sangle spaghetti couleur unie débardeur chemisier lâche plage gilet haut et chemisier été T-shirts décontractés, plus la taille",5.79,3.32,red
15,2019 Summer Women's Fashion Nouvelle robe sans manches à pois à encolure en V et à bretelles en V sans dos Mini robes casual casual top,2.0,3.65,yellow
16,Mode d'été Flare Sleeve Plus Size T-shirt hors de l'épaule mignon couleur unie haut chemise à manches longues,11.0,3.92,Black
17,Nouvelle mode d'été pour femmes Robe sans manches à pois à pois et encolure en V Mini robe à bretelles sans dos Robe de soirée sans dos Robes décontractées Top Robes décontractées,11.0,3.72,red
18,2018 New Fashion Women's Tops Sexy Strappy Sleeveless Dentelle sans manches Crop Cops,5.0,3.83,white
19,Débardeur d'été 5 Couleurs Grandes Tailles été Femme Mode Femme Débardeur décontracté sans manches Débardeur été Sexy Découpe dos ouvert double épaisseur (S-5XL),9.0,3.82,blue
20,S ~ 5XL Zipper Vest Tee Nouveau Col En V Sans Manches Plus La Taille Slim Fit Débardeurs D'été Solide Couleur Casual Tops Blouses,7.0,3.67,red
21,Top Maillot de bain Ensembles Mode Maillots de bain Femme Bikini 2016 Sexy rembourré,11.0,3.84,green
22,Gilet d'été pour femmes Gilet de mode couleur unie pour femmes T-shirt sans manches en coton T-shirt à lacets Hollow Sexy Slim T-shirt débardeur à débardeur,5.0,3.6,black
23,Conception de rosée Femmes Mode D'été Sexy Col En V Gilet Bouton Bretelle Spaghetti Débardeur Coton Sans Manches Débardeur Couleur Unie Camisole Casual Lâche Tops Vacances Plage Porter Plus La Taille S-5XL 5 Couleurs,11.0,3.38,armygreen
24,Mode d'été Femmes À Manches Courtes U-cou Slim T-shirt Style Décontracté Coton Pull Femmes Mode Tee Plus La Taille Blouse Tops Tee,7.0,3.67,armygreen
25,Nouvelle mode pour dames Débardeurs d'été Tops Débardeurs d'été Chemises sexy dos nu Gilet d'été Tops,5.71,3.75,black
26,2018 Mode d'été Femme Camouflage décontracté Camouflage Tank Top Gilet sans manches à col O,9.0,4.15,armygreen
27," Printemps/Été Mode Femme ""miel"" Lettre Imprimé sans manches Chemise Sexy Brodée Gilet Bodycon Tricoté Gilet Coton Veste Tenue décontractée Débardeur Décontracté ",5.65,4.29,white
28,2020 nouvelle mode d'été femmes sans manches noir blanc rose festonné garniture profonde col en V dentelle gilet solide mince débardeurs Tee,1.74,4.25,pink
29,4 Couleur Femmes Mode Casual Couleur Unie Tops Sans Manches Gaine Mode Été Plus La Taille Bref Pull Sans Bretelles Court Coton Tunique Top Crop Top,5.65,4.06,white
30,Sweet Beading Cami Débardeurs pour femmes Spaghetti Strap Summer Vest Tops,5.65,4.37,black
31,Femmes d'été Sling Robes Casual Backless Dress Ladies Floral Printed Dress Swallowtail Dresses Slim Beach Dress,8.0,3.81,khaki
32,T-shirts de couleur unie Bandeau Yoga Gilet Hors Épaule Femmes Sans Bretelles Soutien-Gorge Tube Crop Top,2.66,3.44,black
33,Femmes Mode Gilet Plus La Taille Lâche Casual Pure Couleur Dentelle Sans Manches Camisole D'été Débardeurs,9.0,3.8,yellow
34,Imprimé floral épaule froide à volants été manches courtes chemisier fluide grande taille hauts sexy,11.0,4.16,white
35,Mode d'été femme papillon réservoir gilet sans manches col rond haut décontracté,8.0,2.75,blue
36,New Women Ladies Fashion Summer Skinny High Wasist Washed Short Jeans Pants,14.0,4.06,navyblue
37,Sweat-shirt à manches longues en coton à col rond pour femmes,5.8,3.83,armygreen
38,5 Couleur Femmes De Mode D'été Mince Sans Manches Imprimé Camouflage Robe Taille Haute À Lacets Casual Poche Mini Robes Plus La Taille S-5XL,13.0,4.16,pink
39,Sexy Women Casual T-shirt rayé Long Tops Chemisier Chemisier Kaftan Beach Shirt Mini Robe,9.0,4.26,black
40,Mode féminine été bretelles spaghetti imprimé floral nouer devant mini robe robe sexy,7.0,1.5,white
41,NOUVEAU Red Bull Summer Mens Casual Shorts Pants Loose Cotton Movement Dry Rapidly Fitness Shorts,12.0,3.79,black
42,Été Nouvelles Femmes Mode Let It ~ Abeille Imprimé Casual Col Rond T-shirt Graphique Mignon À Manches Courtes T-shirts En Coton,3.69,3.53,grey
43,Nouveau Mode Femmes Dames Crochet Kimono Tops Manteau Creux,5.0,3.82,white
44,Women Spring and Summer Fashion Soild Color Vest Off Shoulder Bandage Vest Casual Low Cut Sport Wear Ladies Bodycon Sleeveless Tank Top,5.84,3.28,armygreen
45,Costume de sport cool pour hommes d'été Vêtements de sport Costumes de jogging décontractés Ensembles de tenues à manches courtes,16.0,3.0,green
46,Fashion Femmes Combinaisons Salopette Bohemia Maxi Robe Longue Femmes Robe Longue Imprimée Robe Femme Rose Boho Beach Shorts,13.0,4.03,red & blue
47,Robe d'été imprimée à fleurs à manches longues à col en V et à manches longues pour femmes,9.0,3.18,white
48,"Summer Fashion New Women Letter Funny O-neck T-shirt "" I Only Look Up To You "" Love T-shirt / "" Don't Flatter Yourself "" Graphic Tee / March T-shirt",7.0,3.8,black
49,Femmes Mode D'été Col En V Camisole Gilet Couleur Unie Tops Sans Manches T-shirt Lâche Casual Plus La Taille Débardeurs,11.0,3.43,white
50,Mode féminine Maillots de bain Deux pièces Split Bikini Set Summer Printed Beach Bathing Swimsuits,5.84,4.19,blue
51,Womens Fashion 3D Skull Print Cut Out Back Tank Top Summer Chemise graphique sans manches Slim Fit Cotton Gothic Tee Tops Plus Size Vest,1.0,3.8,blue
52,"Femmes lâche décontracté imprimé col en V robe longue, plus la taille vague point robe robe d'été",11.0,3.38,white
53,NOUVEAU Femmes D'été Floral Sans Manches Bretelles Spaghetti Dos Nu Robe Décontractée Robe Courte MINI Robe Robe De Soirée Plus La Taille S-5XL,9.0,4.03,blue & pink
54,Femmes Sexy dentelle Patchwork col en V Col en V Robe de plage d'été sans dos Mini-robe,6.0,3.5,RED
55,Nouvelle mode d'été femmes robe décontractée col rond lâche Big Swing jupe sans manches Soild couleur robe de plage,1.0,3.56,white
56,Sexy Solid Solid Ruffled Chiffon Sling Top Pure Color Femme Débardeur d'été Taille Plus Grande,9.0,4.06,orange
57,Femmes d'été Sling Dress V-cou Floral Strap plissé Casual Pocket Large Dress,6.0,4.0,white & green
58,Zanzea S-5XL Été Femmes Col Ras Du Cou Sans Manches Graffiti Imprimé Casual Lâche Maxi Robe Robes,11.0,4.13,red
59,Femmes D'été Nouvelle Mode Shorts De Sport Couleur Unie Élastique Shorts Femelle Slim Fit Running Pantalon Court Gym Workout Élastique Casual Sport Pantalon Court,7.0,4.0,blue
60,"Pantalon de couleur unie à la mode pour femmes, pantalon décontracté à jambes larges",5.0,5.0,khaki
61,"Femmes Shorts d'été à lacets taille élastique lâche mince pantalon décontracté, plus la taille S-8XL",2.72,3.1,yellow
62,Robe en coton à manches courtes pour femmes d'été de mode classique européenne et américaine,5.87,3.91,white
63,2018 New Fashion Women Casual Playsuit Dames Jumpsuit Romper Summer Floral Playsuit Brand New (3 Colors),11.0,3.72,white
64,"Femmes été tricolore couture manches courtes robe longue dames casual col en V coton, plus la taille robes longues XS-5XL",8.0,2.71,red
65,Plus la taille 4XL 5XL chinois vêtements chemises pour hommes coton lin chemise hauts d'été,14.0,3.81,blue
66,Nouvelle mode d'été femmes robe décontractée col rond lâche Big Swing jupe sans manches Soild couleur robe de plage,2.0,3.47,white
67,Femmes Mode Lâche Casual Soild Couleur Camisole Sans Manches Dentelle Débardeurs D'été,8.0,3.93,yellow
68,Summer Beach Fashion Plus Size Femmes lâche manches courtes Blouses longues Plus Size Deep V-cou Party Dress Dames Casual Solid Color Beach Wear Maillot de bain Cover-up Short Linen Dress,5.79,3.41,white
69,Tendance été nouvelle conception lettre imprimée femmes T-shirts col V profond chemises sans manches débardeurs décontractés,8.0,3.74,winered
70,Robe d'été à col rond pour femmes d'été Robe décontractée sans manches Robe imprimée à fleurs Robe fleurie,4.94,3.93,black & green
71,2018 Femme Femme Mode Note Musicale Débardeur Asymétrique Mode Dames,8.0,3.82,orange
72,Femmes été imprimé grande taille pantalon décontracté lâche pantalon harlan pantalon long,11.0,3.46,black
73,Fashion Women Sleeveless Lace Vest Loose V Neck Solid Silk  Lady Casual Sexy Black Tank Tops,8.0,5.0,black
74,Nouvelle tendance col rond en forme de coeur t-shirt casual hauts lâches femmes mignon drôle t-shirt plus la taille,9.0,4.5,white
75,Femmes Mode Combinaison Courte Spaghetti Strap Sans Manches Barboteuses D'été Une Pièce Ensemble Casual Tenues D'été,7.0,4.26,armygreen
76,Nouveau Mode Femmes Casual Shorts Costume Été Tie-dye Imprimer Halter Bandage Sans Manches Dos Nu Crop Top et Élastique Taille Shorts Pantalon Deux Pièces Ensemble,11.0,4.24,purple
77,Good Vibes Shirt Summer Shirt Rainbow Shirt Rainbow Pattern Shirt Letter Print Shirt Round Neck Short Sleeve Shirt Splicing Shirt Solid Color Cotton Shirt Slim Fit Top Plus Size S-5XL,8.0,3.56,yellow
78,2019 Mode pour femmes Maillots de bain Deux pièces Bikini fendu Bikini Set été Plage Imprimé Maillot de bain de bain,5.83,4.22,whitefloral
79,"S-6XL Summer Cotton Plus Size Women Fashion - Mini robe décontractée sans manches à rayures, sans manches, en coton d'été, pour femme",8.0,3.42,pink
80,7 Couleurs Top 2018 Femme Femme Femme Sexy Top Blouse d'été sans manches Top Blouse Dentelle Gilet Débardeur Chemise,5.77,4.0,armygreen
81,XS-8XL Femmes De Mode D'été Sans Manches Imprimé Floral Sling Dress Deep V-Neck Slim Fit Big Swing Beach Jupes Lâche Casual Longues Maxi Robes Dames Plus La Taille Robes De Soirée,5.9,3.64,grey
82,"Femmes sexy couleur unie bretelles mini robe mode d'été sans manches robe courte, plus la taille",6.0,3.08,red
83,2018 Mode d'été Femmes Débardeurs Débardeurs Femmes Sexy Culottes sans manches Casual Style Femmes Coton Imprimé Dentelle Coutures Irrégulières Blouse Tops（S-5XL),7.0,4.41,green
84,Nouveau Summer Womens Fashion Plus Size Tops Trendy Sleeve Feather Print Lace Up V-neck Off Shoulder Blouse &Shirts S-5XL ,8.0,3.7,pink
85,Plus Size Summer Women Casual Robes Deep V Neck Floral Imprimé Plis Sling Robes,12.0,3.81,black & green
86,Femmes 2019 Mode Bandage de mode 2019 Maillot de bainSuits Colorblock Bikini Ensembles Maillots de bain,5.78,4.0,pink
87,T-shirt décontracté à manches courtes pour femmes,12.0,3.94,white
88,NOUVELLE Robe d'été sans manches imprimée à fleurs pour femmes Robe sans manches à col en V sans manches pour l'été Robe sans dos ,11.0,4.07,floral
89,Summer Women Fashion Fashion Robe courte sans manches Robe taille camouflée Robe camouflage Bodycon Slim Fit Robe grande taille S-5XL,8.0,4.29,pink
90,Femmes été imprimé grande taille pantalon décontracté lâche pantalon harlan pantalon long,11.0,3.46,black
91,Femmes Camisole extensible Spaghetti Strap Long Débardeur Slip Mini Dress 4Color SIZE XXL est disponible maintenant,5.77,4.1,black
92,COMENII Femmes Tuniques d'été Tuniques Robes T-shirt Robe d'été Robe décontractée pliante Femme Basculante ample Robe évasée Manches courtes Robe de plage Robe de plage Sexy O-neck Grande taille Débardeur Robe de poche Robe de soirée Mini robe de soirée Mini robe pour dames Mode Robe en tissu de coton plissé de couleur solide,9.0,3.7,grey
93,Mode féminine d'été T-shirt à manches courtes Dames Femme Col en V Évider Chemisier lâche décontracté Plus la taille Tops,1.72,3.77,fluorescentgreen
94,"Pantalon de couleur unie à la mode pour femmes, pantalon décontracté à jambes larges",1.86,3.57,pink
95,New Summer Fashion Women Striped Stitching Stranger Things Print Tracksuit Stranger Things Clothes 2 Piece Set Woman Sports Suits Shorts Crop Tops   Shorts Pants Outfit,14.0,4.54,black
96,Plus la taille des femmes de la mode lâche décontracté col en V point de vague imprimé floral épissure gilet d'été camisole,3.69,3.64,red
97,"Mode féminine sans manches col profond croix sangle spaghetti couleur unie débardeur chemisier lâche plage gilet haut et chemisier été T-shirts décontractés, plus la taille",5.79,3.32,red
98,Salopette en coton pour hommes Camouflage Shorts lâches Pantalon taille élastique,11.0,4.11,orange & camouflage
99,6 Couleurs Automne Été Dames Casual Lâche Solide Réservoir Salopette Longue Bretelle Salopette Salopette Pantalon Plus La Taille S-5XL,9.0,3.18,red
100,2018 6 Couleurs d'été de la mode d'été des femmes de la nouvelle mode Sexy Whiskey mignon Imprimé dentelle Patchwork Spaghetti Strap Strap T-Shirts Slim Bodycon Off The Shoulder Short Sleeve Blouse Casual Cotton Outdoor Tops Plus Size S-XXXXXXL,6.0,3.96,black
101,2020 Hommes Summer Fashion Brand Summer Suits Casual Athletic Set Short Sleeve Tracksuits 2Pc: Shorts T-shirts,20.0,2.8,green
102,Women Summer Off Shoulder V-neck Bow Top Top Cotton Casual Stretch Slim Slim Fitted T-Shirt,5.66,3.89,black
103,Pnma Hommes Été À Séchage Rapide Shorts Hommes Swim Beach Shorts Shim Shorts Beach Wear Sports Gym,8.0,3.97,white
104,Nouvelle Fashon Women Summer Sleeveless Spaghetti Robe de plage à bretelles sans manches pour femmes Robe décontractée à imprimé floral Robe de fête,8.0,3.61,lightyellow
105,2020 Marque De Mode Imprimé Pantalon Court Casual Jogging Pantalon Slim Fit Hommes Sports,6.0,3.82,grey
106,Summer Cool Leaf - Ensemble bikini imprimé pour femmes - Maillot de bain de plage mode estivale,11.0,3.96,black
107,Nouvelles femmes de mode robe d'été imprimé floral sans manches genou longueur robes dames lâche décontracté bretelles spaghetti robe grande taille,7.0,4.2,white
108,Casual femmes ras du cou à manches courtes feuille imprimé lâche mini robe d'été,11.0,3.77,red
109,2020 Femmes Mode Col En V Couleur Unie Slim Fit Coton Décontracté Deux Pièces Vêtements De Sport,5.8100000000000005,2.61,green
110,Femmes classiques dos nu en dentelle évider licou cou mini robe de soirée,14.0,3.93,blue
111,Womens Summer Fashion Lip Print 2pc Set Ladies Casual Col rond T-shirt à manches courtes et short,5.0,5.0,black
112,Mode femmes shorts en jean couture dentelle d'été jeans shorts 3 couleurs,5.0,4.3,coolblack
113,"Femmes demi-manches lâches chemises d'été décontractées chemisier hauts, plus la taille XS-8XL",11.0,4.12,multicolor
114,Femmes Short T-shirt Shorts Costume Sport d'été Porter Casual Coton Yoga Lady Crop Top et Shorts,12.0,3.67,pink
115,Mode broderie électrique double face petit motif marguerite femme été chapeau de pêcheur solaire extérieur,5.68,4.5,purple
116,Shorts d'été Pantalons Hommes Shorts de bain à séchage rapide Maillots de bain Shorts de plage,11.0,4.0,black
117,VANGULL Camouflage Shorts Fashion Basic New Board Shorts Femmes Loose Pantalon court chaud avec cordon de serrage sans ceinture,17.0,4.16,camouflage
118,Débardeur d'été de mode pour femmes Casual Camisole sans manches à col en V imprimé,7.0,3.71,purple
119,2020 Hommes Marque De Mode D'été Costumes D'été Casual Athlétique Ensemble Survêtement À Manches Courtes 2 Pc: Shorts T-shirts S-4XL,12.0,4.75,green
120,Débardeur décontracté sans manches en coton à ourlet irrégulier,7.0,5.0,black
121,Mode d'été femme papillon réservoir gilet sans manches col rond haut décontracté,7.0,3.0,blue
122,S-5XL Été Nouvelle Mode Femmes Argent Lettre Imprimer Robe À Manches Courtes Jupe Mode Casual T-shirt Robe Plus La Taille,11.0,4.11,yellow
123,2020 Été Femmes De Mode Élastique Taille 3/4 Jogging Capri Tuyau Strass Danse Paisley Cordon Casual Sport Fitness Pantalon,12.0,3.59,lightpink
124,Mode d'été pour femmes Tie-dye imprimé Short imprimé décontracté Ensemble de deux pièces Ensemble de sport,13.0,3.61,yellow
125,Women's Casual Sleeveless Stripe T Shirts Dress Big Swing Maxi Dress Summer Beach Long Dress Plus Size XS-5XL,2.72,5.0,orange
126,NOUVEAU Femmes Casual Débardeurs Blouses O-cou Sans Manches Dégradé Couleur Coton Impression T-shirt D'été Gilet Blouses Lâche Plus La Taille S-5XL,6.0,3.99,green
127,Printemps et été nouveau Tik Tok Ing Ing sans fin lâche grande taille court Crop Top et Shorts Set,9.0,4.03,pink & black
128,Dames d'été Tie Dye Imprimer manches courtes hors épaule Casual Plus Size Dress,5.0,5.0,yellow
129,XS-8XL Femmes Été Casual Tops Col En V À Manches Courtes Chemises Dames De Mode Solide Couleur Coton Lâche T-shirt Plus La Taille De Couleur De Sucrerie Dame Pulls Blouse,5.86,3.73,white
130,Débardeur femme été sans manches col en U imprimé floral mode Débardeurs décontractés grande taille (S-5XL),2.0,3.99,green
131,2019 Chemise sans manches à la mode pour femmes,7.0,4.38,grey
132,Tissu taille formateur gilet chaud shaper été shaperwear minceur réglable sueur ceinture corps shaper,5.66,3.08,black
133,Nouveau Mode Femmes Lettre Imprimer Tie Dye Halter Sans Manches Longue Robe D'été Coton Bohème Maxi Boho Robe,13.0,4.11,pink
134,2019 Nouvelle mode d'été féminine sans manches à pois à pois et encolure en V Mini robes décontractées à bretelles au dos sans dos,8.0,3.6,yellow
135,Femmes Casual Round Open Toe Sandals Female Slippers Vintage Orthopedic Buckle Strap Anti-slip Respirant Summer Beach Sandals Roman Gladiator,11.0,3.78,grey
136,Maillots de bain à rayures pour dames avec double débardeur tankini (plus grande taille),8.0,4.05,black
137,Printemps / Été / Automne Nouvelle Mode Indo-Forme Tête Lâche Grande Taille Couleur Unie Hommes Velours Wirtschafts Hommes,16.0,3.53,red
138,2020 nouvelles femmes d'été loisirs vacances chaussures plates forage chaud tongs sandales,11.0,4.6,silver
139,2018 New Fashion Women Casual Playsuit Dames Jumpsuit Romper Summer Floral Playsuit Brand New (3 Colors),11.0,3.72,white
140,Women Off Shoulder Chest Chest Wrapped Sexy Chiffon Tops Halter Neck Loose Long Sleeve T-shirts à manches longues,8.0,4.16,black
141,Mode féminine déchiré Denim Shorts Casual Été Slim Jeans Court Legging Pant Plus Size S-XXXL,14.0,4.04,lightblue
142,2020 Été Sexy Femmes Halter Tops Plage De Natation Lettre Imprimer Maillots De Bain Lady Push Up Gilet Soutien-Gorge S-5XL,7.0,3.6,black
143,Nouvelle mode femmes sans manches à carreaux Dess Vintage robe d'été au genou décontracté robe de soirée robe,12.0,3.89,pink
144,NEW Women Casual Loose Solid Color Dress Short Sleeve V-neck Dress Plus Size,7.0,3.49,Army green
145,"10 couleurs femmes shorts d'été lacent ceinture élastique culotte lâche, plus la taille S-6XL",2.0,3.07,lightblue
146,"Shorts d'été pour femmes à lacets taille élastique culotte lâche, plus la taille",6.0,3.11,white
147,New Women's Summer Tops Sleeveless Spaghetti Strap Casual Printed Cotton Tank Tops,8.0,4.07,lightgreen
148,Débardeur Tie Dye à panneau ajouré pour femmes,8.0,4.0,lightblue
149,Femmes été hors épaule Tops dentelle coutures chemises Casual Shorts manches chemisier lâche,11.0,3.97,black
150,S-5XL Blouse sans manches S-5XL - Maillots de bain sans manches Plus Grande taille - Débardeurs amples plissés - Débardeurs amples - Femmes décontractées - Été décontracté - Épaule large - Col en V - Gilet dorsal profond sans manches ,3.66,3.19,green
151,Nouvelle mode d'été femmes robe décontractée col rond lâche Big Swing jupe sans manches Soild couleur robe de plage,1.68,3.67,white
152,Mode femmes d'été sans manches robes col en V dos nu robe en dentelle dames robes de plage robe blanche,13.0,2.5,white
153,Femmes Mode Sexy Tie Dye Imprimé Deux Pièces Ensembles T-shirt D'été + Shorts 2 Pièces Ensemble Slim Fit Outfit Costumes,13.0,3.82,yellow
154,Femmes été décontracté lâche couleur unie salopette vintage sangle pantalon long combinaisons barboteuses grande taille,11.0,2.92,winered
155,"Summer Fashion Women - Robe décontractée sans manches à col rond sans manches, de couleur pure, à poches",7.0,3.75,black
156,Gilet d'été sans manches pour femme 4 couleurs avec impression de lettres sur le dessus de la veste en coton pour un entraînement décontracté (S-5XL),4.8100000000000005,4.16,purple
157,2019 Summer Letter Print Funny T-Shirt Women Fashion Cute Sloth Printed Short Sleeved T-shirt Summer Lady Casual Graphic T Shirts Round Neck Pure Color Tee,9.0,4.29,winered
158,Été Élégant Tempérament Impression Femmes Robes Nouvelle Mode Sexy Col En V À Manches Courtes En Soie Office Lady Robe A-ligne,18.0,3.68,red
159,Shorts décontractés pour femmes Shorts sport mode Shorts sport pour femmes Pantalons amples pour l'été Pantalon ample Short en coton,7.0,3.63,khaki
160,Costume de sport cool pour hommes d'été Vêtements de sport Costumes de jogging décontractés Ensembles de tenues à manches courtes,16.0,3.0,green
161,Sexy Women's Summer Casual Sleeveless Evening Party Backless Beachwear Mini Dress 12 colors ,5.0,3.06,mintgreen
162,Femmes été mode lacets pantalon court décontracté taille haute couleur pure crêpe tissé cravate shorts de plage poche coton pantalon court,1.68,3.76,black
163,8 Couleurs Camouflage Pare-Soleil Net Armée Filets En Maille Léger Durable Parasol Patio Jardin Décoration pour Chasse Aveugle Tir Camping Photographie Jungle,7.0,3.81,blue
164,Débardeur en coton sans manches pour femmes,6.0,2.67,pink
165,Shorts de sport pour hommes,13.0,3.76,black
166,Combishort décontracté à manches courtes en dentelle pour femmes,11.0,3.46,black
167,Femmes Été Off Sholuder V-cou Imprimé Big Swing Lâche Casual Plus La Taille Vacances Plage Gradient Couleur Robe Longue Sling Robe Plus La Taille,7.0,3.29,grey
168,Plus la taille des femmes de la mode lâche décontracté col rond Tie Dye Gradient manches courtes d'été T-shirts tops blouses,12.0,2.0,pink
169,Femmes été 2 pièces ensemble Crop Top et short Bodycon Outfit Short Yoga Sport costume,6.0,4.14,black
170,T-shirts décontractés d'été pour femmes Ulzzang Streetwear kawaii dessin animé imprimé Tshirt style coréen Tops Harajuku t-shirt à manches courtes,6.0,3.28,white
171,Mode féminine Double couche taille haute Workout Yoga Shorts Summer Gym Shorts Pants,8.0,3.89,green
172,"Femmes d'été T-shirt robe col en V Slim Fit robe de soirée décontractée Soild couleur, plus la taille robe Midi dames plage porter lâche Mini robes",8.0,3.14,yellow
173,Maillot de bain Maillot de bain Maillot de bain Maillot de bain Bikini Été Plus Maillot de bain Patchwork Beachwear Plus Grande Taille XS-8XL,11.0,3.98,pink & grey
174,2019 The New Women Fashion Bone Hand Pattern Print Spaghetti Strap Cotton Tank Tops Summer Women Casual Bodycon Slim Fit Sleeveless Beach Style Vest,6.0,4.04,pink
175,Pantalons courts pour hommes Pantalons de plage d'été Pantalons de sport,11.0,3.76,black
176,NOUVELLE Été Femmes Sans Manches Col En V Imprimé Floral Plage Sling Robe Grande Robe Swing Lâche Casual Longue Gilet Robes Dames Robe De Soirée Plus La Taille XS-8XL,9.0,4.16,gray
177,Tissu taille formateur gilet chaud shaper été shaperwear minceur réglable sueur ceinture corps shaper,8.0,3.07,black
178,"Pantalon à lacets à la mode pour femmes d'été, plus la taille Pantalon court à taille haute décontracté",3.78,3.35,red
179,Mode Yoga Shorts Femmes Shorts D'été Casual Sports Shorts Gym Workout Waistband Skinny Shorts S-XL,8.0,3.89,white
180,New Summer Women Bikini Set Colorblock High Waist Swimming Bottom Casual Female Beachwear Bathing Suit Swimsuit Underwear,6.0,3.83,green
181,Hommes été bloc de couleur imprimé poitrine poche tourner vers le bas col bouton vers le bas à manches courtes lâche chemises décontractées vacances à la plage,8.0,3.96,white
182,2018 Summer New Women Jupes Longues Jupes Solides Sexy Split Jupes Crayon Sexy 2018,9.0,4.09,black
183,"Haut de bikini crocheté, Haut de bikini, haut de bikini, bikini, maillots de plage, vêtements de croshet, haut de boho, top, top, top sexy",5.65,4.06,black
184,Nouveau mode féminine d'été sans manches Sexy col en V profond débardeur paquet hanche fermeture éclair tunique haut gilet Casual femmes Slim Fit coton t-shirts chemise grande taille S-5XL,3.0,3.4,beige
185,"Robe à manches courtes d'été Femmes Robe lâche décontractée, Plus la taille Robe à col en V à fleurs",8.0,3.8,blue
