id,title,price,rating,color
368,Femmes Floral Print épaule froide à volants d'été à manches courtes Flowy Blouse Plus Size Sexy Tops,7.0,4.01,white
369,Femmes été élégant imprimé floral sans manches col en V profond impression décontractée combinaison d'été barboteuse femmes combinaison,4.0,1.0,blue
370,Mode féminine été décontracté à manches courtes col rond imprimé pas aujourd'hui lettre T-shirt mignon drôle impression coton chemise hauts,6.0,3.13,pink
371,Vintage Kawaii Harajuku T Shirt Women Ullzang Cute 90S summer T-shirt Funny Cartoon Graphic Tshirt 90s Fashion  Tees Female,8.0,5.0,white
372,Nouveau T-shirt en coton à col en V pour femmes d'été Chemisier imprimé lâche Casual Tops à manches courtes Dames Mode Plus Size Shirt,4.0,4.24,winered
373,Maillot de bain Tankini doublé rayé pour femmes (grande taille),11.0,3.92,blue
374,7 couleurs femmes mode d'été Bikini ensemble imprimé floral maillot de bain taille haute décontracté Sexy Crop Tops + Shorts deux pièces ensemble maillot de bain maillots de bain plage porter licou Tankinis grande taille,12.0,3.47,white
375,Femmes été décontracté lâche couleur unie salopette vintage sangle pantalon long combinaisons barboteuses grande taille,11.0,2.99,winered
376,XS-8XL Femmes Faashion D'été Col En V Sans Manches Tops Lâche Plissée Débardeurs Dames De Mode Swing Flowy Hem Shirs Gilet D'été Shirs Tunique Coton Blouses,1.91,4.05,blue
377,Sexy Thong Cheeky Bottom Femmes Beachwear Brésilien Bikini Bra Maillots De Bain Baignade S M L XL,5.7,3.45,black
378,Summer Sexy Women Bag Buckle Tank Tops Top Crop Top Gilet pour femme,8.0,4.47,black
379,"2019 nouvelles femmes mode S-5XL chemisier décontracté femmes couleur unie une épaule hauts d'été, plus la taille sans manches femmes chemisier lâche",9.0,3.58,purple
380,Nouveau Femmes Dames Mode Taille Élastique 3/4 Jogging Capri Summer Faith Imprimé Cordon Casual Sport Fitness Pantalon,5.72,2.5,grey
381,Nouvelle mode d'été femmes robe décontractée col rond lâche Big Swing jupe sans manches Soild couleur robe de plage,2.0,3.2,white
382,Femmes Mode Mignon Volants Tops Courroie De Spaghetti D'été Sans Manches T-shirts Jolie Gilet D'été Vêtements Pour Femmes,9.0,4.16,purple
383,2020 Hommes Marque De Mode D'été Costumes D'été Casual Athlétique Ensemble Survêtement À Manches Courtes 2 Pc,15.0,4.0,white
384,"Vêtements d'été pour femmes, vêtements de sport décontractés, pantalons de jogging à manches courtes pour hommes, ensembles de tenues",20.0,4.17,red
385,8 Couleurs Femmes Nouvelle Mode Tops Blouse Sans Manches Col Rond Amour Imprimer Tops T-shirts D'été Casual Femmes Tops Chemises,6.0,3.67,white
386,"Robe d'été de mode Sexy femmes Casual sans manches plage robe courte gland solide blanc Mini robe en dentelle, plus la taille",3.0,3.08,black
387,Robe de bain et short XS-8XL à pois à large lanière pour dames de taille plus grande,9.0,4.15,red
388,Mode d'été Phases de lune T-shirt imprimé T-shirt manches courtes pour dames T-shirt à manches courtes et col en V T-shirt pour femmes,8.0,3.98,black
389,Été Nouvelles Femmes De Mode Col En V Floral Imprimé Lâche Robe Sans Manches Élégante Maxi Robe Halter Robe XS-5XL,12.0,2.82,whitefloral
390,2020 New Fashion Women's Colorful Mouth Butterfly Print Yoga Suit Sexy Sleeveless Fitness Sports Jumpsuit Bodycon Shorts Summer Rompers Plus Size S-5XL,11.0,3.8,blue
391,2020 Femmes Fille Mode Mignon Imprimé Côtelé Cerise Débardeur Cropped Sans Manches D'été Top Gilet Crop Tops,9.0,3.3,white
392,Femme Fashion Sexy Bow Top Strap Sling Vest Top,7.0,4.33,white
393,Nouvelle Mode D'été Vente Chaude Pingu Noot Noot Motherfu * kers Vintage Femmes Casual Coton À Manches Courtes de Bande Dessinée T-shirts Plus La Taille S-5XL,5.92,3.71,blue
394,Women Fashion Casual Summer Sleeveless Blackless Gilets sans manches Débardeurs Débardeurs Strap Spaghetti Strap Floral Imprimé Chiffon Off Shoulder Blouse Off Shoulder Blouse,8.0,4.34,blue
395,Robe mi-longue d'été à manches courtes pour femmes Baggy Robes pour femmes Shift Kaftan S-5XL,11.0,3.54,black
396,"2019 femmes d'été de mode s à lacets cravate pantalon, plus la taille occasionnelle pantalon taille haute court (s-5xl)",8.0,3.62,black
397,Femmes dentelle plage boho maxi robe d'été sans manches robe longue fête vacances robes sans bretelles,15.0,3.94,white
398,Women's Fashion Lace-up Solid Summer Shorts Dames Casual Short Pantalon Décontracté Taille Plus (S-5XL),8.0,3.59,beige
399,Women Summer New Flip Flops Sandals Beach Shoes Slipper Shoes Comfortable Open Toe Sandals Vintage Anti-slip Breathable Summer Casual Shoes Plus Size ,1.68,3.95,red
400,Jouets d'eau flotteur de rangée ,24.0,4.21,beige
401,Puppy Dog Cat Canvas Baseball Cap Outdoor Pet Sun Hat Pet Supplies Virsor Caps,5.65,3.67,blue
402,Printemps et été nouveau Tik Tok Ing Ing sans fin lâche grande taille court Crop Top et Shorts Set,13.0,4.35,pink & white
403,Robe d'été en dentelle florale à volants en crochet pour femme,16.0,4.07,white
404,Plus la taille des femmes de la mode lâche décontracté sans manches imprimé floral col rond gilet d'été camisole,5.83,4.36,yellow
405,Femmes Robe décontractée rayée imprimé été Robe décontractée Robe débardeur Gilet T-shirt Chemisier Chemisier,7.0,3.32,black
406,Women Wraped Banded Draped Out Hi Low Asymmetrical High Waist Open Maxi Skirt,8.0,3.98,black
407,New Women Ladies Fashion Summer Skinny High Wasist Washed Short Jeans Pants,14.0,4.06,navyblue
408,XS-8XL Tunique d'été pour dames Tunique d'été pour dames Chemises sans manches aux épaules Chemises pour dames Mode décontractée Chemisier ample en coton Chemisier T Chemises sans dos Camisole Veste camisole Couleur pleine grandeur T-shirts de réservoir grande taille,5.65,4.23,winered
409,Robes de mode grande taille Vêtements d'été Femmes Casual Coton Robe sans manches Lâche Couleur unie Débardeur plissé Mini robe Dames Col en V profond Vêtements de plage Robe de soirée,1.8,3.68,lightgreen
410,Tissu taille formateur gilet chaud shaper été shaperwear minceur réglable sueur ceinture corps shaper,7.0,3.0,black
411,Tissu taille formateur gilet chaud shaper été shaperwear minceur réglable sueur ceinture corps shaper,1.75,3.0,black
412,Jeans de mode d'été pour femmes Shorts en denim lâche Shorts de curling décontractés Jeans à bande élastique,9.0,4.06,black
413,Plus la taille S-5XL dames manches courtes été lâche robe en denim midi femmes jeans robes,12.0,3.49,blue
414,T-shirts mode pour femmes Let It ~ Abeille Imprimé Casual Col rond T-shirt graphique Mignon T-shirts à manches courtes Top d'été,8.0,3.84,white
415,Summer Fashion Women Sexy Lace Strap Shirt Tops Solid Color Sleeveless Top Blouse,5.0,4.5,pink
416,Nouvelle mode d'été femmes robe décontractée col rond lâche Big Swing jupe sans manches Soild couleur robe de plage,11.0,3.74,black
417,Women Summer Fashion - Robe d'été à col rond sans manches imprimée et double épaisseur - Robe décontractée plus grande taille ample - Robe d'été,8.0,3.54,white
418,Mode féminine grande taille lâche impression de feuilles décontractées imprimé floral manches courtes col en V robe d'été,7.0,4.0,beige
419,2020 Plus La Taille De Mode Femmes D'été Débardeurs Occasionnels Lâche Blouses De Plage Sans Manches Bohême Imprimé Coton T-shirt De Plage,6.0,3.51,pink
420,Outdoor Sand-proof and Waterproof Pocket Beach Blanket Portable Compact Multifunctional Lightweight Outdoor Travel Blanket  Nylon Mat for Beach Picnic Camping Hiking Activities,6.0,4.19,blue
421,Femmes d'été mode robe courte florale bretelles spaghetti chérie robe fourreau,13.0,3.42,rosered
422,Mode Femmes Débardeurs Noir Plume Imprimer Workout Fitness Gilet Top Sexy D'été Sans Manches O Cou T-shirt Tops Tops,7.0,4.08,black
423,Femmes Summer Fashion Bikini Set Floral Print Maillot de bain taille haute Casual Crop Tops + Shorts Deux pièces Set Maillot de bain Maillots de bain Beach Wear Halter Tankinis Plus Size,13.0,3.5,red
424,NOUVEAU Red Bull Summer Mens Casual Shorts Pants Loose Cotton Movement Dry Rapidly Fitness Shorts,12.0,3.88,black
425,Été Womens Bow Tie Plaid Romper Dress Jumpsuit Shorts Suspended Checked Pants Beach Dress,5.71,4.23,red
426,"2020 Nouvelle Arrivée Femmes De Mode Drôle ""HIPPIE SOUL"" Imprimé Mignon T-shirts D'été À Manches Courtes Tops Chemises Graphique T-shirts Plus La Taille S-5XL",11.0,3.0,white
427,2018 Plus Size Summer Women Fashion Fashion Sexy col en V à lacets sur le haut de la blouse Plaid Plaid Tops Irregular Short Sleeve Shirt（S-5XL）,3.79,3.93,red
428,Femmes été floral imprimé manches courtes robe dames décontracté col en V robes grande taille robe XS-5XL,8.0,3.39,navyblue
429,Sexy Femmes Casual Slim Sans Manches Débardeur Cami Gilet Blouse Crop Top Fitness Gilet,2.0,4.09,white
430,"Nouvelles femmes d'été mode femmes sans manches imprimé floral fronde robe de soirée robes de soirée robe maxi robe de plage robe d'été col en V robes longues, plus la taille S-5XL",6.0,3.74,yellow
431,Femmes d'été Sling Dress V-cou Floral Strap plissé Casual Pocket Large Dress,6.0,4.2,white & green
432,New Women Fashion Summer Two Pieces Set Ladies Female Pure Color Suit Sleeveless Tops Shirts Crop Top and Skinny Fitness Shorts Leggings,13.0,3.75,winered
433,Shorts pour femmes Coton Sport Yoga Shorts Femmes Mode Dentelle Patchwork Fitness Culottes Bas D'été Athlétique Lounge Pantalon Court,8.0,4.25,pink
434,Women Off Shoulder Floral Print Boho Dress Women Beach Summer Dresses Ladies Strapless Long Maxi Dress Vestidos Female,7.0,5.0,tan
435,4 Couleur Nouveau Été Femmes Mode Abeille Motif Imprimer Coton T-Shirt O-cou Slim Fit Casual Tops Couleur Unie Drôle Street Style Lady Tee Plus La Taille,11.0,4.05,black
436,Women's Fashion Summer Sexy Slimn Fit Denim Shorts Taille Haute Jean Shorts NS0122,11.0,3.91,blue
437,Femmes Lady Shorts de sport Gym Workout Skinny Élastique Fitness Yoga Leggings Pantalon Pantalon d'équitation à cinq points Pantalon de base de danse Slim,8.0,3.8,grey
438,Nouvelle mode d'été femmes robe décontractée col rond lâche Big Swing jupe sans manches Soild couleur robe de plage,1.65,3.67,white
439,Femmes Mode Shorts de sport double couche Leggings de sport de yoga à séchage rapide Shorts de fitness,8.0,3.7,black
440,Women Summer Fashion - Robe d'été à col rond sans manches imprimée et double épaisseur - Robe décontractée plus grande taille ample - Robe d'été,12.0,3.76,white
441,Mode pour hommes T-Shirt d'été Fitness Camouflage Imprimé Chemises à col rond Manches courtes T-shirts décontractés à manches courtes,9.0,3.84,white
442,2019 Summer Women Spaghetti Strap Mini Robe Femme Nouvelle Mode Robe sans manches Femme Sexy Package Hip Mini Robe Décontractée Style Slim Sexy Women Robe d'été Taille Grande,8.0,3.33,black
443,Womens Summer Fashion Lip Print 2pc Set Ladies Casual Col rond T-shirt à manches courtes et short,5.0,5.0,black
444,Nouvelle Vente Chaude D'été De Mode Femmes Fille A-ligne Mini Courte Gress Lâche Sans Manches Flamingo Vintage Imprimé Floral Gress,11.0,3.0,black
445,Maillot de bain femme Bikini Trim Maillots de bain Beach Beach Wear Swim Wear Cover Up Dress Blouse T Shirt,11.0,4.29,blue
446,Femmes Mode Halter Sequin Blouse Été Casual Sans Manches Couleur Unie Tops T-shirts Plus La Taille S-5XL,9.0,3.75,red
447,S-5XL Nouvelle Mode Femmes Tops Blouse Sans Manches Col En V Solide Couleur Débardeur Femmes D'été Chemise Tops Plus La Taille,7.0,3.12,armygreen
448,Femmes dentelle Boho Bikini Cover Up Cardigan Blouse Long Sunscreen Blouse,6.0,3.93,black
449,2020 5 Couleur Été Nouvelle Mode Femmes Tops Blouse Plus La Taille Sans Manches Bretelles Débardeurs Cross Back Tops Été Causal Tops pour Femmes S-5XL,7.0,4.24,red
450,Nouvelle mode d'été femmes robe décontractée col rond lâche Big Swing jupe sans manches Soild couleur robe de plage,1.65,3.67,white
451,Mayzero New Summer Femmes Robe Long Beach Boho Imprimé Floral Sexy Split,11.0,3.92,white
452, Pantalon à bretelles 3 couleurs Nouvelle mode d'été pour dames Combinaison décontractée Combinaison d'été à bretelles longues Pantalon à bretelles,11.0,4.08,green
453,Vente chaude Femmes Sexy Poitrine Sangle Sling Gilet D'été Style Top Doux et Comfotable Fitness Robe,7.0,4.12,black
454,2019 Été 2 Couleur Femmes Mode Bikini Set Spaghetti Strap Crop Top Taille Haute Triangle Maillots De Bain Imprimé Léopard Deux Pièces Push Up Maillot De Bain Maillot De Bain,8.0,4.01,white & black
455,Le 2018 été Shorts Jeans Jeans Girl Hot Pocket Taille Casual Shorts Casual Shorts Femmes Sexy Dentelle Blue Denim Shorts,15.0,3.95,blue
456,COMENII Summer Women Sexy Tops Button Deep V-Neck Off Shoulder Shirts Chemisiers en coton Blouse Décontractée T Shirts Sans manches Décontractés T Shirts sans dos Camisole Camisole pour dames Gilet Mode pour dames Gilet Couleur unie Harnais Couleur pleine taille Débardeur Grande taille 4XL 5XL 6XL,7.0,4.41,rosered
457,Femmes Robes D'été De Mode Col En V Dos Nu Robe En Dentelle Robes De Plage Robe Blanche Plus La Taille XS-5XL Robe Femme,11.0,3.08,pink
458,XS-5XL Plus La Taille À Manches Courtes Robe De Plage Femmes D'été Imprimer Col En V Robe Lâche Casual Pull Midi Robe,6.0,3.0,yellow
459,Femmes d'été Sling Dress V-cou Floral Strap plissé Casual Pocket Large Dress,8.0,4.07,white & green
460,"Shorts d'été pour femmes à lacets taille élastique culotte lâche, plus la taille",2.0,2.92,lightblue
461,6 Color Summer Women Printed Bckless Tank Tops Women New Fashion Slim Sleeveless Yoga Fitness Vest Casual Lady Tops Plus Size S-5XL,8.0,4.04,grey
462,Palm Angels Sanskrit T-shirt court Hip Hop Streetwear Oversize Summer Kanye West Tops T-shirt,22.0,4.04,black
463,Femmes école filles une ligne robe d'été filles un treillis robe courte taille haute jupe de tennis plissée uniforme avec short intérieur,11.0,3.89,white
464,Mode Femmes D'été Débardeurs Décontractés Lâche Blouses De Plage Sans Manches Imprimé Coton T-shirt De Plage Plus La Taille,6.0,3.73,yellow
465,Femmes Mode Débardeur Débardeur Blouses Décontractées Crop Tops T-Shirt emilyandlily Nouveau Top,6.0,4.22,black
466,2020 Shorts de course taille haute Legging grande taille S-3XL 3 couleurs été nouvelles femmes mode couleur unie Shorts de sécurité Yoga,9.0,3.84,grey
467,2019 nouvelles femmes mode pantalon lâche taille haute neuvième pantalon pantalon décontracté,12.0,3.64,black
468,Robe sans manches à imprimé floral Élégante et élégante Robe longue de plage avec cordon de serrage à la taille. ,6.0,3.71,black
469,Femmes Soutien-gorge rembourré Haut Soutien-gorge rembourré Col en V Bretelles Camisole Soutien-gorge Push Up Gilet Débardeur,9.0,3.81,black
470,Hommes Shorts de course d'été 2 en 1 Sports Jogging Fitness Shorts Training Short de gymnastique à séchage rapide Short Pantalon de sport,18.0,4.62,black
471,Mode Femmes Salopette D'été Bavoir Pantalon Shorts Casual Lâche Sans Manches Barboteuses Salopette Bretelles Salopette S-XXXL,11.0,2.95,orange
472,S-2XL Femmes Motifs tournesol imprimés Robe à bretelles à motif tournesol Robe femme mode d'été à fleurs Jupe à bretelles jeunes filles Robe à bretelles pour filles,13.0,3.7,black
473,2017 Nouvelles Femmes Dames D'été Soild Couleur À Manches Courtes Lâche Casual Col En V Split Baggy Poche Longue Robe Pleine Longueur Robe,11.0,3.66,black
474,COMENII Été Femmes Tops Bouton Profond Col En V Hors Épaule Chemises Blouse En Coton Casual Lâche Sans Manches T-shirts Dos Nu Camisole Dames Mode Gilet Solide Couleur Sling Plus La Taille Débardeurs,11.0,4.09,purple
475,Dentelle D'été Princesse De Bal Punk Robe Femmes Casual Robe De Base Moda Hippie Vêtements,11.0,4.14,white
476,Femmes Crop Tops Deep V Neck Sans manches Slim Fit Solid Tops Solid For Summer,9.0,5.0,white
477,Débardeur en coton sans manches pour femmes,6.0,2.67,pink
478,XS-8XL Robes Plus La Taille Vêtements De Mode D'été Femmes Col V Profond Sans Manches Maxi Robes Dames Casual Spaghetti Strap Lâche Plage Porter Floral Imprimé Halter Party Dress,2.83,3.62,grey
479,Combinaison décontractée décontractée à bretelles longues à bretelles larges Pantalons à bretelles à bretelles larges Pantalons à bretelles Rompers à bretelles larges Pantalons à bretelles larges,7.0,3.39,armygreen
480,Femmes d'été Sexy Floral robe courte bretelles spaghetti chérie robe fourreau,15.0,3.23,blue
481,Femmes été longue robe spaghetti sangle col en V ourlet irrégulier vacances décontractée robe de soirée robe d'été plus la taille S-5XL,14.0,3.44,white
482,Nouveau été hommes chat Caterpillar bulldozer pantalon court sport,12.0,5.0,black
483,2020 Femmes Mode Col En V Couleur Unie Slim Fit Coton Décontracté Deux Pièces Vêtements De Sport,5.8100000000000005,2.61,green
484,2020 New Men's Fashion Short Sleeve T-Shirt   Shorts Men Sports Set Men Casual Summer Men's Set,16.0,3.15,grey
485,"Summer Fashion New Women Letter Funny O-neck T-shirt "" I Only Look Up To You "" Love T-shirt / "" Don't Flatter Yourself "" Graphic Tee / March T-shirt",7.0,3.8,black
486,"T-shirt sans couture pour femmes, mode d'été, bandeau long basique, superposition, t-shirt stretch côtelé",8.0,3.95,Black
487,Femmes sexy été plage dentelle sans manches soirée soirée cocktail patineuse mini robe,12.0,3.56,white
488,Boho Vintage Women - Robe longue sans manches à imprimé floral - Robes Vestidos - Robes longues tuniques décontractées à volants et manches d'été,11.0,4.1,floral
489,Femmes deux pièces imprimé floral bikini ensemble taille haute sport shorts maillot de bain maillot de bain,11.0,3.93,leopard
490,T-shirt à manches courtes T-shirt jersey sans manches,5.69,3.61,red
491,Mode féminine Boho Long Dot Dress Long Dress High Silt Printed Beach Dress XS-5XL,12.0,3.28,black
492,2020 Été Sexy Femmes Halter Tops Plage De Natation Lettre Imprimer Maillots De Bain Lady Push Up Gilet Soutien-Gorge S-5XL,7.0,3.6,black
493,Fashion Women Back Deep V V Sexy Gilet sans dos Sexy Débardeur sans manches Slim T-shirt femme haut slim,7.0,3.35,gray
494,Women Sister Shirt Cute Cat Imprimé Couple d'été Débardeur Dessus Veste S-3XL,5.66,4.29,grey
495,Mode décontractée d'été pour femmes,5.0,3.88,pink
496,Maillot de bain une pièce à manches volantées pour femme - Maillot de bain monokinis à bretelles ajustables - Maillot de bain monokinis - Maillot de bain une pièce,14.0,4.16,black
497,2019 Punk Style Femmes Squelette Imprimé Premium Moulante Slim Fit Élasticité Souple Noir Été Casual Shorts,6.0,4.28,multicolor
498,Maillots de bain à rayures pour dames avec double débardeur tankini (plus grande taille),8.0,4.02,navy blue
499,Plus la taille des femmes de la mode lâche décontracté sans manches imprimé floral col rond gilet d'été camisole,5.83,4.36,yellow
500,1PCS Maillot de bain Monokini Maillot de bain Monokini Body sans dos Maillot de bain femme,11.0,4.08,white
501,2019 nouvelle mode femmes lâche col rond robe manches courtes couleur unie tenue décontractée,1.85,3.9,black
502,2019 Short de jogging d'été pour hommes,9.0,3.61,black
503,Summer Quick-Dry Ellesse Shorts Hommes Siwmwear Shorts de plage Shorts de bain Beach Wear Sports (9 couleurs),8.0,3.59,black
504,Women Fashion Sexy Sleeveless Crop Cops en tricot sans manches Sexy,3.0,3.81,wine red
505,T-Shirt T-Shirt décontracté décontracté pour femme T-Shirt imprimé T-shirt Chemisier imprimé pour blouse d'été T-Shirt,6.0,3.9,white
506,Women's Fashion Summer Clothes Beach Sleeveless Dresses Star Printed Loose V-neck Dress Casual Cotton Party Dress Ladies Fashion Plus Size Mini Dress XS-8XL,3.86,4.0,white
507,Nouveau Women Slim Outfits Loose Outfits Crop Top Short Sorts Short Pantalons à lacets Pantalons Casual Running Jumpsuits Yoga Rompers,9.0,4.03,black
508,Women Loose Casual Printed V Neck Long Dress Plus Size  Wave Point Dress Summer Dress,5.89,3.25,red
509,Mens Summer Cotton Breathable Solid Color Buttons T-Shirts T-Shirts Casual Slim Short Sleeve Shirt Tops,11.0,3.62,mintgreen
510,Femmes Couleur unie Taille élastiquée Taille décontractée Short décontracté Taille ample Short d'été ample,8.0,3.95,black
511,2018 Femmes d'été Femmes Sexy Off Shoulder Shirt Casual Half Sleeve Top Ladies Fashion Printing Loose T-shirts Plus Grande Taille Blouse en coton Blouse XS-5XL,8.0,4.17,blue
512,Costume de sport cool pour hommes d'été Vêtements de sport Costumes de jogging décontractés Ensembles de tenues à manches courtes,11.0,3.33,white
513,Costume de sport cool pour hommes d'été Vêtements de sport Costumes de jogging décontractés Ensembles de tenues à manches courtes,11.0,3.33,white
514,S-5XL Plus La Taille D'été Femmes De Mode Salopette Casual Lâche Solide Réservoir Salopette Longue Bretelle Salopette Salopette Salopette Barboteuses Pantalon Jambes Larges,8.0,2.0,black
515,Femmes d'été mode sexy robe de soirée irrégulière imprimé floral dos nu moulante,2.0,3.88,gray
516,Shorts de sport de mode pour femmes Gym Workout Yoga Fitness Shorts à taille élastique Shorts d'été,5.66,3.41,black
517,Mode féminine Décontracté à manches courtes Teinté Dégradé Impression Col rond T-Shirt Tunique Tops Lâche Plus La Taille Blouses D'été,9.0,4.1,purple
518,Combinaison Wrap à encolure en V Slim Street Coupe-vent 2019 Summer Tight Jumpsuit Women's Drawstring Jumpsuit Jumpsuit Shorts,8.0,4.08,red
519,Casual Ladies Spaghetti Strap Débardeur D'été T-shirts Mode Baggy Sans Manches Blouse Top Plus La Taille S-2XL,9.0,3.78,red
520,Femmes d'été mode O-cou sans manches rayures impression Slim Fit Casual coton débardeur,2.76,4.33,green
521,Plus la taille d'été femmes décontracté sans manches barboteuses combinaisons combinaison de couleur unie jarretelles pantalons lâche salopette,3.83,3.57,lightred
522,Women's Fashion Caroset Flanelle Flanelle Plissé Elastique Taille Haute Sexy Shorts (8 Couleurs),7.0,4.47,black
523,Maillot de bain Bikini Maillot de bain Bikini 5 Couleurs Femme Mode Mode Sexy Combinaison de bain Slim Fit Spaghetti Bracelet Camouflage Maillot de bain une pièce Bikini Maillot de bain sans dos,6.0,3.46,Pink
524,2019 New Women Fashion Sexy Tank Bone Hand Pattern Print Spaghetti Strap Cotton Tank Tops Summer Women Casual Bodycon Slim Fit Sleeveless Beach Style Vest Plus Size S-5xl,8.0,4.06,white
525,2020 femmes d'été mode spaghetti sangle imprimé floral cravate devant mini robe robe sexy,8.0,4.16,grey
526,"Femmes Shorts d'été à lacets taille élastique lâche mince pantalon décontracté, plus la taille S-8XL",2.66,2.67,yellow
527,Femmes mode cocktail soirée maxi robe en mousseline de soie d'été plage robe en dentelle,8.0,3.37,multicolor
528,Women's Fashion Chiffon Shirt V-neck Long Sleeve Loose Tops Zipper T-Shirt,8.0,3.55,skyblue
529,Femmes dentelle voir à travers sexy lace up taille basse creux bikini ensemble de lingerie,3.67,3.32,white
530,S-XXL Mode Eté Printemps Femme Elastique Taille Haute en Dentelle Short Short Short Hot Pants,12.0,4.08,white
531,Slit Bohemia Maxi Longue Robe Femme Imprimée Rose Boho Beach Shorts Soirée Party,13.0,4.06,navyblue
532,"Deux pièces robe femmes mode d'été tournesol imprimé plage robe décontractée noué à manches courtes tunique hauts, plus la taille S-5XL",9.0,3.89,grey
533,Nouveau Femmes Ensemble Court Mode Imprimé T-shirt À Manches Courtes et Shorts Pantalon 2 Pcs Femmes Sports Yaga Costumes 5 Couleurs,9.0,4.63,white
534,Femmes Élégant Sans Manches À Rayures T-shirts Robe Robe De Soirée Grande Balançoire Longue Col Rond Maxi Robe D'été Color-block Plage Robe Longue Plus La Taille S-5XL,8.0,3.38,yellow
535,Grande Taille Femme Robe Fleurale Robe Collect Largeur Taille Mini Robe d'été à bretelles spaghetti et fines bretelles,12.0,4.14,navyblue
536,Summer Women Sexy Cropped Tops Fashion Sleeveless Push-up Vests Backless Solid Tank Tops S-2XL,5.0,3.8,black
537,Débardeur Femme Haut Débardeur Bandage Plume Imprimé sans manches Gilet col en O Sport d'été Débardeur Décontracté Femme Chemisier Chemise T-Shirt Grande Taille,6.0,4.27,black
538,Mode Femmes Robes Sexy Robes V Col V Robe de plage en dentelle sans dos Robe de plage Robe Blanche Grande Taille S-5XL,14.0,3.7,yellow
539,T-shirt Femme 4 Couleurs Mode d'été Femme Couture Dentelle Sexy Couture Couture Couleur unie T-shirt Femme Femme Coupe Mince Taille Plus Grande Chemisier T-shirt T-shirt Taille Plus,8.0,4.34,white
540,T-shirt décontracté à manches courtes pour femmes,8.0,4.03,white
541,Pandolah Hot Women Maillot de bain une pièce Maillot de bain à pois Maillot de bain Push up Maillot de bain grande taille Monokini M-3XL,18.0,4.23,black & white
542,Femmes Mode Lâche Casual Sans Manches Fleur Imprimer Col En V D'été Gilet Camisole Casual Plus La Taille Lâche Débardeurs,3.93,3.54,yellow
543,Femmes Casual Strap Off-Shoulder Tie-Dye Print T-Shirt Summer Fashion Holiday Shirt Beach Wear Top Blouse à manches longues en mousseline de soie Blouse Bohemian Style Shirt Blouse Plus Size S-5XL,11.0,3.12,orange
544,Femmes d'été Boho Maxi Polka Dot Robe Irrégulière Sans Manches Casual Beach Wear Robe d'été,6.0,3.67,coffee
545,Womens Summer Bikini Tankini Off Épaule Double Maillot De Bain Maillots De Bain Maillot De Bain Tankini,8.0,4.37,yellow
546,Mode féminine foi lettre impression t-shirts camisole hors épaule T-shirt d'été dames grande taille à manches courtes chemisier haut,11.0,4.33,white
547,Femmes Floral Print épaule froide à volants d'été à manches courtes Flowy Blouse Plus Size Sexy Tops,7.0,4.01,white
548,Femmes Robes D'été De Mode Col En V Dos Nu Robe En Dentelle Robes De Plage Robe Blanche Plus La Taille XS-5XL Robe Femme,12.0,5.0,yellow
549,Pantalon de mode d'été Femmes Leggings Pantalon déchiré Pantalon slim Pantalon vert armée Collants,11.0,3.56,armygreen
