id,title,price,rating,color
731,Nouvelle mode femmes mode lâche chemisier décontracté sans manches imprimé floral col rond gilet d'été camisole grande taille,11.0,3.8,green
732,T-shirt en coton à col en V pour femmes d'été Chemisier imprimé lâche Chemises à manches courtes décontractées,5.0,3.97,winered
733,Femmes Casual Backless Strap Siamese Trousers Deep V-neck Drawstring Pure Cotton Jumpsuit Print Sleeveless Combinaison Femme_JHAO,5.75,4.26,black
734,Nouveau Women Fashion Loose Shorts Short Short Short de plage taille élastiquée taille d'été Short Pantalon de plage,8.0,3.32,green
735,Mode féminine Maillots de bain Deux pièces Split Bikini Set Summer Printed Beach Bathing Swimsuits,7.0,3.95,black
736,Fashion Women Vintage Vertical Striped Mini Sexy Button Cami Spring Summer Dresses,6.0,4.0,blue
737,Gilet d'entraînement en néoprène pour le sauna et le sauna Gilet d'entraînement d'été Vêtements d'entraînement d'été pour le corps Slimming Adjustable Sweat Belt Fajas Body Shaper,11.0,3.78,rosered
738,Summer New Tank Top Women's Fashion Loose Casual Sleeveless Design Floral Printed Spaghetti Strap Tank Top Plus Size  Tops  S-6XL,5.65,3.96,black
739,Femmes T-shirts manches courtes Tops Lettre Imprimé Coton Été Casual T-shirts T-shirts S-5XL,8.0,4.14,white
740,Summer Beach Fashion Plus Size Femmes lâche manches courtes Blouses longues Plus Size Deep V-cou Party Dress Dames Casual Solid Color Beach Wear Maillot de bain Cover-up Short Linen Dress,5.0,3.6,white
741,"2019 été nouvelle mode féminine ""Let It ~"" Bee '' imprimé décontracté col rond graphique T-shirt mignon à manches courtes en coton T-shirts",11.0,4.05,black
742,Summer Women's Fashion Sleeveless V-neck backless Dress Street Sexy punk Party Dress,49.0,4.67,Rose red
743,"Pantalon à lacets à la mode pour femmes d'été, plus la taille Pantalon court à taille haute décontracté",5.0,4.83,red
744,Muscle Tops Vest T-shirts pour hommes Weste Undershirt Spaghetti Strap Tank Slim Man Fasion,4.66,2.92,black
745,Tissu taille formateur gilet chaud shaper été shaperwear minceur réglable sueur ceinture corps shaper,7.0,3.0,black
746, Nouvelle Mode Automne Été Femmes À Manches Longues Col En V Robe Longue Imprimé Floral Split Maxi Robe Fête De Vacances Plage Robe D'été Robes De Soirée,19.0,3.4,greysnakeskinprint
747,5 Couleur New Summer Femmes Mode Spaghetti Strap Long Dress Sexy Gradient Chiffon Beach Dress-parole longueur Casual O-Neck Robe sans manches Plus Size S-5XL,23.0,3.86,orange
748,Combinaison Femme Imprimé Hors Épaules Barboteuses Combishort D'été,9.0,3.84,white
749,Femmes Maillot de bain une pièce Maillots de bain Maillots de bain push up bikini monokini Maillot de bain,6.0,3.41,pink
750,ZANZEA Femmes Mode À Manches Courtes Ras Du Cou Polka Dot Kaftan Vacances Beach Club Party Longue Maxi Robe Robe Longue Robes Plus Kleid,14.0,3.92,red
751,Nouvelle Mode Femmes Couleur Unie Causal Dialy Demin Barboteuse Salopette Combinaison Demin Pantalon Demin Bleu Grande Taille S-3XL,22.0,3.66,denimblue
752,Nouveau Femmes Mode Shorts D'été Yoga Shorts Été Plage Court Athlétique Shorts Pantalon Sport Shorts Gym Workout Waistband Casual Shorts,8.0,2.98,green
753,"Femmes Shorts d'été à lacets taille élastique lâche mince pantalon décontracté, plus la taille S-8XL",2.66,2.67,yellow
754,Nouvelle mode d'été femmes robe décontractée col rond lâche Big Swing jupe sans manches Soild couleur robe de plage,2.0,3.47,white
755,Mode féminine Robe sexy Robe formelle Une variété de façons de porter une jupe sexy à encolure croisée 15 couleurs,16.0,4.34,black
756,Femmes été sans manches col en v hauts T-shirt de couleur pure débardeurs décontractés chemisier boutonné lâche chemises sans manches grande taille,11.0,3.75,purple
757,Dames Sexy - Robe sexy sans dos en dentelle avec encolure creuse Halter - Mini robe à bretelles à col bénitier,14.0,3.74,white
758,Women Summer Hollowing Out Halter Dress Robe sans manches à encolure en V,8.0,4.18,green
759,5 Couleurs Femmes Filles D'été Drôle Lettre Imprimé Personnalisé T-shirts Dames Casual Streetwear Comfy Blouse T-shirts,9.0,4.22,blue
760,2020 Summer Bodycon Rompers Womens Slim Fit Jumpsuit Chest Zipper Solid Color Short Sleeve V-Neck Shorts Bodysuit,14.0,4.23,black
761,2019 Nouvelle robe d'été à col en V à imprimé léopard et bordures de feuilles de lotus à col en V profond pour la mode féminine ,11.0,3.76,white
762,HODMEXI Robes d'été en dentelle pour dames Robes de soirée grande taille Robe longue sans manches élégante pour dames HODMEXI,15.0,3.96,black
763,Femmes été élégant imprimé floral sans manches col en V profond impression décontractée combinaison d'été barboteuse femmes combinaison,4.0,1.0,blue
764,Hakuna Matata Lettre Imprimer Tee Shirt Été Femmes T-shirt À Manches Courtes Plus La Taille Femmes Casual Coton Top Drôle T-shirt,5.75,5.0,white
765,"Mode féminine, plus la taille décontractée à manches courtes lâche d'été imprimer robe à col en V",9.0,3.29,red
766,2019 New Women Crop Top Ribbed Short Sleeve T-shirt manches courtes Casual Cotton T Shirt T-shirt Tops Fashion Tee Hot,6.0,3.21,black
767,Pantalon skinny pour femmes Pantalon de yoga de couleur pure décontracté Pantalon sport Pantalon court Legging Pantalon femme,8.0,4.09,black
768,Mode d'été col en V femmes décontracté lâche manches demi chemisier hauts,5.73,3.69,yellow
769,COMENII Femmes d'été Décontractées Col rond Fleuri Imprimé sans manches Débardeur de plage Top de plage sans manches Robes de fête A-line Robes de poche Sexy Short Club Party Mini Halter Robe Midi Robe Ete Femme Jupes Plissées Longueur Genoux Jupes Dames Mode Swing Cotton Robe T-Shirt Taille Plus S-6XL,8.0,3.9,white
770,Femmes sexy dentelle fronde robe d'été sans manches débardeur robe gilet débardeur chemisier,11.0,3.35,winered
771,2020 Summer Fashion Dress for Women's Dress Short Sleeve Slim Print Mini Dress Summer Sexy Skirt,8.0,3.67,brown
772,2020 Shorts classiques pour hommes d'été Pantalons décontractés à poches multiples Salopette d'été lâche Pantalon cargo,7.0,5.0,grey
773,Women's Fashion - Chemise sans manches à encolure en V de couleur unie avec bouton en V - Débardeur décontracté et sexy - Débardeur décontracté - Grande taille XS-5XL,4.0,4.0,purple
774,Mini robe de soirée décontractée sans manches pour femmes,13.0,3.22,applegreen
775,Robe chemisier à manches longues pour femmes occasionnelles pour femmes,12.0,4.15,offwhite
776,Robe de bain et short XS-8XL à pois à large lanière pour dames de taille plus grande,9.0,4.15,red
777,2018 Nouveau T-shirts d'été Femmes Sexy col en V à col en V T-shirts Camouflage à manches courtes imprimées T-shirts à manches courtes plus taille T-shirt (S-4XL),5.78,3.55,grey
778,Mode pour dames Maillot de bain taille haute Maillot de bain New Bikinis Push Up Bikini Set Vintage Retro Bandage Maillot de bain Vintage Beach Suit Wear,5.86,4.28,black
779,Femmes dames mode note musicale débardeur asymétrique été hauts plus la taille,9.0,3.82,blue
780,XS-8XL Nouvelles Femmes De Mode D'été Sans Manches Dégradé Impression Sling Dress Deep V-Neck Big Swing Party Dress Casual Long Beach Skirt Ladies Loose Mini Dress Plus Size Slim Fit Maxi Dress,3.87,3.34,lightgray
781,Mode d'été Dabbing Pug T-Shirt Hommes les plus récents T-shirts drôles Tops Hip Hop Tee,9.0,4.52,white
782,Nouvelles femmes mode deux pièces tournesol imprimé bikini ensemble maillot de bain maillot de bain plage porter taille haute bikini maillots de bain,5.74,3.38,yellow
783,2019 Débardeur grande taille été 2019 pour femme Débardeur décontracté sans manches à bretelles spaghetti imprimé fleurs (S-6XL),9.0,4.06,beige
784,M-XXL Taille Été Nouvelles Dames Papillon Impression Bohème Plage Jupe Col En V Sans Manches Casual Tempérament Robe,8.0,5.0,white
785,New Summer Women's New Fashion Sleeveless Polka Dot V-neck Strap Mini Backless Casual Top Dresses,3.68,3.71,navy
786,Hommes d'été Viking Tattoo Art T-shirt T-shirts imprimés en 3D Top à manches courtes décontracté,4.86,3.89,white
787,Été nouvelle mode femmes deux pièces vêtements de nuit en soie douce ensembles de pyjama occasionnels (6 couleurs) ,11.0,3.96,red
788,Mode féminine Boho Long Dot Dress Long Dress High Silt Printed Beach Dress XS-5XL,12.0,3.29,black
789,Mode pour dames Robe à 1/2 manches Robe décontractée à col en V Robe bandage mince à la taille Robe d'été pour dames Robe normale Robe d'été pour dames Robe d'apparat à couleurs unies Robe-cadeau pour dames,15.0,3.3,green
790,Grande taille mode femmes été débardeurs décontractés chemisiers de plage en vrac sans manches imprimé coton plage t-shirt,3.91,3.73,yellow
791,Short cargo d'extérieur d'été pour hommes Coupe décontractée à poches multiples Taille élastique Short décontracté,11.0,3.16,black
792,ZANZEA Femme Casual Beach Col V Manche Courte Loose Plage Robe Dresse Maxi Plus,11.0,3.46,orange-red
793,Été Hommes Shorts de fitness Sports Running Beach Shorts Shorts de gym pour hommes Shorts de musculation,8.0,4.18,green
794,2018 Femme Femme Mode Note Musicale Débardeur Asymétrique Mode Dames,8.0,3.82,orange
795,Mode Femmes Robe de fête BOHO Robe d'été imprimée à rayures pour dames Robe longue de plage imprimée grande taille S-5XL,14.0,4.36,black
796,Mode d'été femme papillon réservoir gilet sans manches col rond haut décontracté,7.0,3.0,blue
797,Femmes Casual Hippie Lettre Imprimé Robe Longue Sans Manches D'été Irrégulier Lâche T-shirt Robes Plus La Taille,6.0,4.0,armygreen
798,Mode féminine Combinaison sans manches Couleur unie Dames Slim Short Bodycon Rompers Femmes Spaghetti Strap Bodysuit,6.0,4.18,yellow
799,Mode d'été pantalons décontractés pantalons courts pour femmes minces externes pantalons moyens grands pantalons s-6xl,12.0,3.0,white
800,Mode femmes & dames aiguës d'été en mousseline de soie lâche hauts à manches longues chemise chemisier décontracté,9.0,4.0,camel
801,"Pantalon à lacets à la mode pour femmes d'été, plus la taille Pantalon court à taille haute décontracté",3.88,3.47,red
802,COMENII 2018 New Women Summer Casual Tunic Tank Top Top Tunic Robe Décontractée Robe de plage en V Sexy Beach Wear Off Shoulder Party Robes sans manches A-line Ruffles Pockets Robes T-Shirt Robes Femmes Fashion Coton Couleur unie Button Robe grande taille,8.0,3.96,navyblue
803,Grande taille mode femmes crâne imprimé sans manches mini robe dame fille décontracté col en V réservoir robe lâche punk tunique robe,12.0,3.98,winered
804,Femmes Mode D'été Décontracté Découpé Halter Neck Crop Top Casual Cross Sport Fitness Gilet Yoga Tops Camisole,5.65,3.39,armygreen
805,"Mode féminine été nouveau débardeur sans manches confortable en mousseline de soie coupe basse haut Slim Fit hauts décontractés pour femmes, plus la taille S-5XL",11.0,4.46,rosered
806,Nouvelle femme d'été pour femmes Camisole extensible Spaghetti Strap Long Tank Top Slip Mini Dress Fashion Sans manches Backless Low Cut Top Camisole Spaghetti Strap Dress Beach Dress 7 Color,12.0,3.82,red
807,2019 New Fashion Summer Women Casual Dress Round Neck Round Neck Loose Big Swing Skirt Sleeveless Soild Color Robe de plage de couleur douce,5.74,3.61,white
808,2020 nouveau 3 couleurs mode femmes pantoufles creux sandales compensées d'été patchwork pantoufles pantoufles augmentées,9.0,4.13,black
809,Summer Women Bohemia Push-Up Push-Up Padded Bra Bikini Beach Bikini Set Maillot de bain Maillots de bain,8.0,3.45,green
810,Mini robe de soirée décontractée sans manches pour femmes,8.0,3.39,green
811,2019 été femmes sling robes décontracté dos nu robe dames floral imprimé robe machaon robes mince robe de plage,5.79,3.78,white
812,"Shorts d'été pour femmes à lacets taille élastique culotte lâche, plus la taille",8.0,3.27,white
813,"2020 Summer Women Summer Fashion Spaghetti Strap Floral Print Tie Front Mini Dress Sexy Dress, Robes de soirée, Robe de danse, Robes de soirée",2.79,4.0,grey
814,"Mode féminine d'été décontracté Cross Bandage robe lâche coton couleur unie, plus la taille robe en dentelle plissée",9.0,3.73,pink
815,Fashion Femmes Combinaisons Salopette Bohemia Maxi Robe Longue Femmes Robe Longue Imprimée Robe Femme Rose Boho Beach Shorts,13.0,3.49,green
816,Femmes Mode Plus La Taille Lâche Casual Couleur Pure Dentelle Sans Manches Camisole Débardeurs D'été,8.0,3.68,orange
817,2019 Chemise de chat de mode à manches courtes imprimée pour femme T-shirt imprimé T-shirt décontracté Chemise décontractée Coton à manches courtes Plus Size Gilet d'été,5.65,4.24,navyblue
818,Grande taille vêtements de mode robes d'été femmes décontracté sans manches licou robe de soirée dames col V profond imprimé floral plage porter Maxi robe,4.86,3.79,white
819,2019 Nouvelle Mode Femmes D'été Drôle Pingouin imprimer T-Shirts Casual À Manches Courtes O-Neck Tops Lâche Coton Mignon Cool Tee Plus La Taille S-5XL 4 Couleurs,6.0,3.82,green
820,T-shirt décontracté à manches longues en dentelle décontractée pour femmes,6.0,4.01,black
821,2019 été Femmes Mode Noeud papillon Plaid Romper Robe Combinaison Short Suspendu À Carreaux Vêtements Robe De Plage,8.0,4.22,red
822,Plus Size S-5XL - S-5XL - Pantalon court à lacets de couleur unie - Pantalon de sport d'été pour femmes - Pantalon de sport décontracté à taille haute pour femmes - Short de yoga pour femmes,11.0,3.45,Black
823,Sexy Femmes Bikini Set Bandage Push Up Maillots De Bain Rembourrés Maillot De Bain Baignade Été Beachwear,9.0,3.93,green
824,2019 nouvelle mode printemps été femmes pantalons longs manches courtes hors épaule combinaison,12.0,3.8,black
825,Nouveau Summer Women's Fashion Bikini Set couleur unie deux pièces Maillot de bain taille haute Maillot de bain sexy sans dos Vêtements de plage,14.0,3.85,orange
826,2020 Soon To Be Mom Summer Short Sleeve Pregnant T-Shirt Seen You Soon Baby Cute Cartoon Pattern Print Funny Maternity Shirt Pregnancy Mom Shirts,8.0,4.07,black
827,2020 été nouvelles femmes mode col en V imprimé floral robe lâche sans manches élégant Maxi Dress Halter Dress,8.0,3.09,yellow
828,Summer New Europe and The United States Sexy Round Neck Pocket Stripes Printed Hip Dress Women,8.0,5.0,yellow
829,Été Femmes Hors Épaule Imprimé Col Rond Lâche Casual Plus La Taille Grande Balançoire Robe Longue Plus La Taille Épissage Sans Manches Plage Robe Longue,7.0,3.44,red
830,Femmes Casual manches courtes lâche plis hauts chemisier bouton T-shirt grande taille S-5XL,7.0,3.59,red
831,Femmes d'été Floral Print Cross Halter Wide Leg Jumpsuit,16.0,4.05,beige
832,Mode d'été Femmes Crêpe Tissé Cravate Pantalon Été Casual Taille Haute Shorts,11.0,3.78,yellow
833,S-5XL Summer Women Casual Tops Off Shoulder Fashion Female T Shirt Plus Size Blouse,9.0,4.09,black
834,Women's Fashion Boho Robe Longue Robe Longue Robe de Plage Imprimée Haute Silt S-5XL_S,5.0,3.29,blue
835,Hexagon Mulit Style Mulit Sacs à Main Sacs à Paille Sacs à Main en Rotin Été Femme Sacs de Plage Tissés à la Main Sacs Messagers Épaule de Plage,7.0,4.23,green
836,Sexy femmes mode Shorts lâches lacent taille élastique Summer Beach pantalons courts Shorts,9.0,3.6,black
837,Vintage femmes cheveux chouchou écharpe bowknot solide chiffon doux titulaire queue de cheval été bandeaux élastiques cravates cordes pour les filles,1.76,4.63,white
838,Summer Crop Top Femmes Débardeurs Halter Gilet Casual Camisole Croped Shirt Femmes Tops,5.0,4.07,gray
839,Nouveau T-shirt mode pour dames Chemise ananas Graphic Tees Summer Short Sleeve Round Neck T-Shirt T-Shirt Tops,8.0,4.23,black
840,"Nouvelle mode femmes col rond été polka dot robe sans manches imprimée dames occasionnel mi-longueur, plus la taille robe",4.69,3.95,green
841,Été Femmes Mode À Manches Courtes O-cou Plume Imprimer T-shirt En Coton Casual Street Style Tops 4 Couleurs S-5XL,8.0,4.15,green
842,Mini robe d'été à imprimé floral à la mode pour femmes,6.0,3.47,grey
843,Mode d'été femme papillon réservoir gilet sans manches col rond haut décontracté,6.0,2.33,blue
844,XS-5XL Plus La Taille À Manches Courtes Robe De Plage Femmes D'été Imprimer Col En V Robe Lâche Casual Pull Midi Robe,6.0,3.0,yellow
845,8 Colors Plus Size Summer New Women Fashion Ladies Casual Sleeveless Tops Summer Sexy Cutout Back Open Double Layer Tank Top Plus Size S-5XL,4.65,5.0,lightpink
846,Papillon Imprimer Coton Masque Visage Sport En Plein Air Rencontrez Masque D'isolement D'été Nouvelle Mode À La Mode Masque De Rue Casual Bandana pour les Femmes Soins de Santé,2.67,5.0,purple
847,Femmes été au large de Sholuder col rond imprimé Big Swing lâche décontracté vacances plage longue robe,11.0,3.5,red
848,S-5XL Femmes Mode Camouflage Imprimer Dentelle Patchwork Sport Yoga Shorts Fitness Culottes Bas D'été Athlétique Salon Pantalon Court,5.0,4.0,pink
849,New Summer Femmes Mode Double Couche Hipple Sans Manches Asymétrique Lettre Robe Décontractée Irrégulière Ourlet Boho Robe Maxi Robe Taille S-2XL,11.0,4.22,purple
850,6 Couleurs Mode Femme Ensembles Sport Femme Hauts et Shorts Solides Col rond sans manches Sexy pour Femme Taille Plus S-4XL,7.0,3.98,grey
851,2019 Femmes Mode Robe D'été Papillon Imprimer Sans Manches Court O-cou Mini Robe Au-dessus Du Genou Décontracté Lâche Plus La Taille Poches Boutons Robe Taille S-5XL,12.0,3.61,white
852,Été Nouvelles Femmes De Mode D'été Sans Manches Lisse Comme Jennessee Whisky Lettre Imprimé Coton Chemises Graphiques Débardeurs,1.72,4.33,yellow
853,Female V-neck Hollow Out Casual Loose Blouse Plus Size Tops Summer Women's Fashion Short Sleeve T Shirt ,1.72,4.23,fluorescentgreen
854,2018 Hot Selling Printemps Eté Femmes Pantalon évasé Causal Pantalon ample Pantalon à cordon élastique Taille moyenne Taille moyenne Pantalon large jambe,8.0,4.21,gray
855,Femmes Mode Tie Dye Imprimé Deux Pièces Ensembles Été Hors Épaule T-shirts + Tie Dye Chemises 2 Pièce Ensemble Outfit Costumes,5.8,3.83,rosered
856,Été Femmes Casual Sleeveless T-shirts sans manches T-shirts amples Chemises en coton de couleur unie Chemises sexy à col en V profond Bouton de Halter Blouse Blouse Femme Swing Mode Swing T-shirts Flowy T-shirts Lady Gilet en coton grande taille T-shirts Débardeurs en coton XS-6XL,7.0,4.12,black
857,Enfants En Plein Air Doux Air Rempli D'eau Bulle Boule Gonflable Ballon Jouet Amusant Partie Jeu D'été Cadeau Pour Les Enfants Gonflable Cadeau,3.66,3.2,green
858,Femmes Simple Plain Swim Leggings Capri Swim Bottom Plus Size S-4XL,3.83,3.76,black
859,Maillot de bain de plage d'été HOT Maillot de bain Taille Plus pour femmes Ensemble bikini bandage pour femmes Maillot de bain d'été HOT Maillots de bain rembourrés dos nu pour femmes,13.0,4.36,black
860,Filles Coton Tee Débardeur Vêtements Froid Épaules Tops Femmes Casual Mignon Lettre Imprimer T-shirt D'été,6.0,3.85,blue
861,Femmes d'été Sling Dress V-cou Floral Strap plissé Casual Pocket Large Dress,8.0,4.0,white & green
862,Nouveau Mode Femmes Lâche Shorts Taille Élastique D'été Casual Pantalon Court,1.71,4.67,grey
863,Mode féminine d'été Taille élastique 3/4 Jogging Capri Tuyau Strass Dance Paisley Cordon Casual Sport Fitness Pantalon,12.0,3.87,lightpink
864,"Vêtements d'été pour femmes, vêtements de sport décontractés, pantalons de jogging à manches courtes pour hommes, ensembles de tenues",20.0,4.17,red
865,Bikini 3 Styles Femmes Mode d'été taille haute imprimé floral Taille haute Maillot de bain Bikini 2 pièces Bikini de plage Maillot de bain,9.0,4.17,black
866,(S-7XL) Femmes Camisole Été Imprimé Gilet Floral Sans Manches Gilet Col V Chemise Plus La Taille,2.0,3.73,green
867,5 Couleurs De Mode Femmes Sans Manches En Dentelle Bralette Femmes Crop Top D'été Floral Dentelle Bras Top Cropped Cami Débardeurs Plus La Taille,5.0,3.4,black
868,S-5XL Nouvelle Mode Femmes Tops Blouse Sans Manches Bretelles Débardeurs Cross Back Tops D'été Causal Femmes Tops Plus La Taille,9.0,4.14,purple
869,Pantalon de mode d'été Femmes Leggings Pantalon déchiré Pantalon slim Pantalon vert armée Collants,11.0,3.56,armygreen
870,Printemps et été nouveau Tik Tok Ing Ing sans fin lâche grande taille court Crop Top et Shorts Set,16.0,4.27,gray & white
871,Femmes d'été décontracté lâche couleur unie sans manches robe avec poche,7.0,3.23,white
872,2018 Nouvelle mode d'été 2018 pour femmes Débardeur sans manches sexy Débardeur imprimé floral T-shirts décontractés en coton pour femmes plus grandes tailles pour femmes Vest（S-5XL）,7.0,3.93,purple
873,Femmes sexy Boho à capuche moulante sans manches Sexy Party Cocktail Mini robe mode MEIfang,8.0,3.69,grey
874,Été Femmes Mode Chemise Sans Manches Bohème Casual Imprimé Lâche Sling Col En V Blouse Débardeur Gilet,8.0,3.8,grey
875,Femmes Casual lâche col rond manches courtes imprimé floral Polka Dot Pocket Summer Dress,8.0,3.66,white
876,Femmes Mode Casual Thai Harem Pantalon D'été Hippy Pantalon Taille Haute Pantalon De Yoga Lâche,3.0,4.04,brown & yellow
877,S-5XL Plus La Taille Vacances D'été Femmes Col En V Style Mini Robe Sans Manches Pur Couleur Robe Robe De Plage Casual Robe Lâche,8.0,3.12,skyblue
878,Mini robe de soirée décontractée sans manches pour femmes,6.0,3.18,rose
879,MXNINA  Sexy Women's Summer Casual Sleeveless Evening Party Backless Beachwear Mini Dress wmnC16122400387E21,9.0,3.51,green
880,2019 Summer New Women's Fashion Tops Casual Cross Straps Shirt Solid Color Vest Casual Loose Tops,11.0,3.73,winered
881,Robe imprimée d'été col rond imprimé femmes manches courtes robe vintage,13.0,3.36,red
882,Fashion Femmes Fashion Bretelles Print Crop Tops Costumes Taille Haute Shorts Sexy Deux pièces Sexy Ensemble,11.0,4.16,white
883,Femmes d'été Jurassic Mom of Dino Débardeurs Casual Vest Don ' t Mess avec MamaSaurus Vous obtenez ' Jurasskicked chemise drôle maman chemisier sans manches ,7.0,4.02,white
884,New Ladies Fashion Print Top Summer V-neck Sleeveless Top,9.0,5.0,black
885,Été Femmes Mode Robe Courte Sans Manches Taille Robe Camouflage Robe Moulante Slim Fit Robe Plus La Taille XS-8XL,8.0,4.19,pink
886,S-5XL Nouvelle Arrivée Femmes Mode Blouse T-shirt À Manches Courtes Boss Lady Imprimer Col Rond Coton T-shirt D'été Casual Femmes Tops T-shirts Plus La Taille,8.0,4.06,pink
887,Femmes Mode Mode Spaghetti Combinaisons à bretelles Rompers Summer Casual Slim Fit Taille ajustée Lien de serrage Taille une pièce Costume sexy sans manches Bodycon Playsuit Outfits Set Femmes Short Rompers Bodysuits pour vêtements de plage,6.0,4.26,grey
888,5 Couleur Grande Taille Robe De Camouflage Femmes ' s Fashion Print Dress Summer Fashion Slim Sexy Robe Sans Manches Taille Haute Dentelle Jupe Longue Casual Loose Pocket Pocket Jupe S ~ 5XL,14.0,4.5,grey
889,ZANZEA Casual femmes bretelles robe en coton sans manches été surdimensionné mi-mollet robe,13.0,4.09,pink
890,Short en denim bleu avec trou déchiré à franges vintage Short en jean à poches pour femme Short en jean décontracté Short d'été pour fille d'été Hot Shorts,13.0,4.14,navyblue
891,Femmes grande taille robe de mode d'été sans manches lâche imprimé floral robe longue,5.0,3.88,black
892,Pantalon décontracté d'été Pantalon à cinq points pour femmes Section mince Vêtements d'extérieur Pantalon moyen Grande taille Femme Lâche Femme,3.69,4.36,black
893,Femmes d'été Bohême Push-Up rembourré soutien-gorge plage Bikini Set maillot de bain Swimwear_C,3.85,3.23,multicolor
894,Nouvelle mode d'été femmes robe décontractée col rond lâche Big Swing jupe sans manches Soild couleur robe de plage,11.0,3.91,white
895,Femmes d'été Mode Débardeurs Sexy Sans Manches Crop Tops Style Décontracté Femmes Coton Imprimé Dentelle Coutures Irrégulières Blouse Tops （XS-5XL),2.0,4.19,green
896,2020Newest [1200mAh sans fil] Summer Mosquito Bug Zappers Alimentation par batterie Électrique Fly Swatter Bug Zappers Raquette Insectes Killer Home Bug Zappers,8.0,4.5,white
897,Femmes Mode Sports Ensembles Crop Tops et Shorts Sans Manches Col Rond Sexy pour Dames Fitness Costumes Plus La Taille,7.0,3.36,black
898,Robe d'été Sexy Femmes Casual Sans manches Plage Robe courte Gland Mini robe en dentelle Plus la taille,11.0,3.73,white
899,Nouveau Mode Femmes Bavoir D'été Pantalon Shorts Casual Lâche Sans Manches Barboteuses Salopette Bretelles Salopette,11.0,3.2,black
900,NOUVEAU Débardeur été grande taille pour femme à bretelles spaghetti imprimé fleurs sans manches Débardeur décontracté,2.7,4.13,floral
901,Plus la taille d'été femmes décontracté sans manches barboteuses combinaisons combinaison de couleur unie jarretelles pantalons lâche salopette,5.83,3.99,green
902,Pantalon de mode d'été Femmes Leggings Pantalon déchiré Pantalon slim Pantalon vert armée Collants,11.0,3.76,black
903,Les sports d'été portent des ensembles de jogging décontractés à manches courtes,12.0,3.97,white
904,Tissu taille formateur gilet chaud shaper été shaperwear minceur réglable sueur ceinture corps shaper,5.66,3.08,black
905,Robe femme Summer Beach Maxi Dress Femme Imprimé floral Boho Long Dress,16.0,4.0,black
906,OH FOR FOX SAKE Print Summer Women Fashion Funny Sleeveless Tank Tops Casual Loose Workout Tops,3.67,4.09,black
907,5 Couleur Été Nouvelles Femmes Mode Casual Style Beach Wear Bikini Set Floral Print Sexy Maillot de bain pour Femmes Plus La Taille S-3XL,12.0,3.73,yellow
908,Nouveau Mode Femmes Bavoir D'été Pantalon Shorts Casual Lâche Sans Manches Barboteuses Salopette Bretelles Salopette,2.71,3.4,pink
909,Chaussettes basses pour hommes Chaussettes invisibles peu profondes Printemps et été Chaussettes courtes Pur coton Chaussettes respirantes Medias Femininas Chaussettes pour hommes,5.73,4.03,black
