id,title,price,rating,color
1091,Femmes Nouvelle Mode D'été Couleur Unie Casual Débardeurs Plus La Taille Spaghetti Strap Femmes Crop Tops Sans Manches Femmes Casual Gilet Tops Camisole S-3XL,5.67,3.51,white
1092,Été Nouveau Design De Mode Femmes Sans Manches T-shirt Couleur Unie Col V Profond Bouton Gilet Casual Lâche Coton Tops pour Femmes Bref Basique Tee Shirt Débardeur Plus La Taille XS-5XL 5 Couleurs,6.0,3.26,wine
1093,Summer Fashion Women Round Neck Dress With Pockets Polka Dot Dress Long Loose Dress,11.0,3.58,darkblue
1094,Maillot de bain Maillot de bain Maillot de bain Maillot de bain Bikini Été Plus Maillot de bain Patchwork Beachwear Plus Grande Taille XS-8XL,8.0,4.14,pink & grey
1095,Femmes Dames Mode Plus Size Daisy Sans Manches Chemises Décontractées,7.0,5.0,blue
1096,Women's Fashion Sleeveless American National Independence Day Flag Print Spaghetti Strap Tank Top Irregular Hem Blouse T-shirts Plus Size S-5XL,14.0,4.23,blue
1097,2019 Femmes Dames Mode Plus La Taille D'été Tie Dye Imprimer Manches Courtes Une Épaule Robe Décontractée,14.0,4.04,yellow
1098,Women's Ten Colors S-XXL Robe robe à manches courtes Robe tunique d'été Robe d'été Pure Colors Dersses,8.0,4.13,black
1099,Chaussettes basses pour hommes Chaussettes invisibles peu profondes Printemps et été Chaussettes courtes Pur coton Chaussettes respirantes Medias Femininas Chaussettes pour hommes,2.0,4.15,white
1100,Mini robe de soirée décontractée sans manches pour femmes,8.0,3.09,armygreen
1101,Chemise en coton Tops Femme Casual Casual Lâche à manches courtes imprimé chemise pour femme,2.0,3.9,green
1102,"Shorts d'été pour femmes à lacets taille élastique culotte lâche, plus la taille",2.0,2.92,lightblue
1103,Femmes Mode Robe D'été Papillon Imprimer Sans Manches Court O-cou Mini Robe Au-dessus Du Genou Casual Lâche Plus La Taille Poches Boutons Robe Taille S-5XL,9.0,3.03,yellow
1104,Débardeur pour femme Débardeur Bandage Plume Imprimé sans manches Gilet col en O Débardeur sport d'été Débardeur pour femme Chemisier pour femme T-shirt pour femme Grande taille,3.0,4.29,black
1105,Fashion Women Tassel Patchwork Loose Casual Dress Sexy Short Sleeve Off Shoulder Halter Dress,9.0,4.14,purple
1106,NOUVELLES femmes manches courtes Baggy Summer Beach Midi Dress Ladies Shift Kaftan Dresses,11.0,3.61,gray
1107,T-shirts décontractés d'été Tube d'épaule unique Crop Top Femmes Soutien-gorge à bretelle unique Yoga Vest AOM,4.0,3.51,green
1108,Vente chaude Femmes Sexy D'été De Mode Sans Manches Camisole Réservoir Zipper Top T-shirt En Forme De I Sangle Arc Gilet,11.0,3.66,white
1109,Nouvelle Mode D'été Sexy Femmes Halter Tops Plage De Natation Lettre Imprimer Maillots De Bain Lady Push Up Gilet Soutien-Gorge S-5XL,4.0,4.13,black
1110,Robes d'été de mode féminine col en V dos nu robe en dentelle robes de plage robe blanche grande taille S-5XL,4.9,3.96,pink
1111,2019 Mode féminine New Flare Sleeve Boat Neck Off The Shoulder Blouse Summer Women Manches longues Poignets élastiques Taille Top Casual Slim Fit Lady Plus Size Tops,9.0,3.85,white
1112,Été Femmes Bretelles Imprimé Lâche Salopette Barboteuse Robe Shorts Hors Épaule Col En V Slim Robe De Plage,12.0,3.65,darkblue
1113,Summer Beach Fashion Plus Size Femmes lâche manches courtes Blouses longues Plus Size Deep V-cou Party Dress Dames Casual Solid Color Beach Wear Maillot de bain Cover-up Short Linen Dress,7.0,3.28,white
1114,Women Fashion Ruffles - Ensemble deux pièces avec décolleté plongeant et pantalon skinny,7.0,3.73,pink
1115,2019 nouvelle mode femmes lâche col rond robe manches courtes couleur unie tenue décontractée,1.85,3.9,black
1116,Femmes Robes D'été De Mode Col En V Dos Nu Robe En Dentelle Robes De Plage Robe Blanche Plus La Taille XS-5XL Robe Femme,12.0,5.0,yellow
1117,Grande taille femmes mode polka chemise décontractée dot lâche automne S-5XL,12.0,4.04,khaki
1118,Printemps et été dans le nouveau sud bordeaux coréen jupette marine foncée robe anti soleil avec une doublure jupe duveteuse jupe femme jupe plissée jupe à plis sexy,5.88,4.07,ivory
1119,Womens Summer Bohemia Floral Beach Dress Ladies Kaftan Loose Sundress Plus Size,15.0,4.23,green
1120,FUERFITS - Women's Casual Beach - Summer Sleeveless - Robe d'été à bretelles réglables et à bretelles fleuries,8.0,4.39,black & yellow
1121,Women's Sleeveless Spaghetti Strap Camouflage Print Package Hip Mini Robe Décontractée en coton Slim Fit Robes de soirée en coton ,9.0,4.2,purple
1122,2020 Summer Dress Women Fashion Printed BTS Sexy Short Skirt Casual Short Sleeve Cotton Beach Dress,9.0,3.0,brown
1123,2019 Nouveau Style Mode D'été Femmes Casual One Piece Slim Fit Bretelles Jupe Robe Sans Manches Couleur Unie Slip Dress,8.0,3.38,winered
1124,Mens T-Shirts  Summer Popular Tik Tok Printed Tops Tee Male T-shirt Short Sleeve tshirt for Men Casual Top,7.0,5.0,white
1125,Femmes Été Casual Manches Courtes Col Rond Manches Évasées Robes Couleur Unie Robes Lâches Robes Courtes Plus La Taille,6.0,3.3,red
1126,Summer Short Sleeve Slim Bodycon Women Sexy T-shirt Elastic Cotton Tee Top,4.7,3.87,black
1127,2019 Femmes Nouvelle Mode Robe Stretchy Camisole Robe Spaghetti Strap Backless Sans Épaule Longue Débardeur Slip Summer Fashion Floral Mini Dress,6.0,3.67,beige
1128, Summer Women s Fashion Lace Up Tie Pants Plus Size Casual High Waist Short Pants(S-5XL),4.93,3.77,red
1129,Mini robe de soirée décontractée sans manches pour femmes,3.0,3.94,gray
1130,Nouveau T-shirt d'été 4 couleurs pour femmes à manches courtes en dentelle de couleur unie à manches courtes et col en V T-shirt Fitness Causal Summer Pullover Sweatshirt grande taille S-5XL,8.0,3.94,black
1131,XS-8XL Plus La Taille Sans Manches D'été Tops Mode Vêtements Femmes Casual Floral Imprimé Blouses Dames Plage Porter Des Chemises Plissées Deep V-cou Débardeurs,2.0,3.87,black
1132,Robe d'été décontractée sans manches pour femmes Robe de plage sans manches Robe de soirée mini-robe courte de plage,8.0,4.14,winered
1133,"Maillot de bain Bandage Bikini Bikini Femme Maillot de bain dos nu Maillot de bain Push Up Maillot une pièce Grande Taille XL,XXL,XXXL",14.0,3.65,black
1134,INCERUN Été Hommes Chemises À Manches Courtes Vert Bleu Jaune Casual Chemises En Lin De Coton Henley,15.0,3.87,yellow
1135,"Femmes demi-manches lâches chemises d'été décontractées chemisier hauts, plus la taille XS-8XL",8.0,4.23,multicolor
1136,Nouvelle arrivée femmes été sexy robe de soirée élégante sans manches col roulé mini robe,5.67,3.53,grey
1137,ZANZEA Femmes Été Col Rond À Manches Courtes Coton Robe De Base Robes De Couleur Unie,14.0,4.22,grey
1138,Mode féminine décontracté col en v sans manches bretelles spaghetti paillettes débardeurs,7.0,3.36,pink
1139,Women's Sleeveless Sleeveless Deep V-neckage Package Hip Zipper Tunic Shirt Tunic Vest Casual Women Fashion Slim Fit Cotton Tee Tee Top Tank Top ,9.0,3.94,white
1140,New Women Fashion Shorts Yoga Shorts Summer Beach Short Athletic Shorts Pants Sport Shorts Gym Workout Waistband Casual Shorts,11.0,5.0,black
1141,Costume de sport cool pour hommes d'été Vêtements de sport Costumes de jogging décontractés Ensembles de tenues à manches courtes,16.0,3.0,green
1142,Mini robe de soirée décontractée sans manches pour femmes,6.0,3.31,armygreen
1143,9 couleurs hommes 2019 été coton respirant mince manches courtes boutons de couleur unie T-shirts chemises décontractées,12.0,3.36,pink
1144,1 pcs Shorts de course pour hommes 2 en 1 Sports Jogging Fitness Shorts Formation d'été Séchage rapide Court Gym Shorts Pantalon de sport,16.0,3.28,black
1145,Mode féminine à manches courtes col rond Débardeurs T-shirt imprimé plumes,12.0,4.21,white
1146,Été Femmes Sexy Robe Longue Sans Manches Col En V Casual Beach Party Dress Robe d'été Plus La Taille S-5XL,13.0,3.48,black
1147,Mode Femmes Blanc D'été Boho Sexy Dentelle Creuse Tricot Bikini Maillots De Bain Couvrir Crochet Plage Mini Robe Tops Blouse,11.0,3.75,white
1148,New Women Fashion Summer Casual Party Party Beach Maxi Beachwear Beachwear Bikini Cover-Up,11.0,3.91,white
1149,"Pantalon à lacets à la mode pour femmes d'été, plus la taille Pantalon court à taille haute décontracté",3.71,3.45,yellow
1150,Femmes d'été mode sexy robe de soirée irrégulière imprimé floral dos nu moulante robes de glissement Mei,6.0,3.8,grey
1151,Gilet d'entraînement d'été en dentelle sans manches pour femmes 5 couleurs avec débardeur en dentelle.,6.0,3.89,grey
1152,Pantalon à bretelles d'été pour femmes Shorts décontractés Shorts sans manches Barboteuses Jumpsuit Jarretelles Pantalon Salopette,12.0,3.28,jasper
1153,Women Fashion Vintage Animal Dragonfly Owl Printed T-shirt Women Loose Sleeveless Summer Shirt Tee S-XXXL,5.0,5.0,green
1154,Plus Size S-3XL New Women Fashion Loose Pants Pantalon ample taille haute Pantalon neuvième pantalon Pantalon Pantalon en lin,5.0,3.3,lightkhaki
1155,Sexy Women Gilet d'été Top Sleeveless Blouse Blouse T-shirt Tank Tops Casual T Shirt Better SS,4.66,4.01,purple
1156,L'âme d'une sirène Femmes Débardeurs Mode Gilet d'été Chemise Casual Graphic Tees Plus Size,8.0,4.0,blue
1157,Robe d'été sans manches imprimée sans bretelles pour femme,9.0,5.0,white
1158,New Vogue Women Summer Sofy Casual   Funny Printed Sleeveless Long T Shirts  Mini Dress  Plus Size,8.0,3.95,black
1159,Femmes Style de mode Denim Shorts taille haute Pantalons d'été Femmes Shorts Jeans,5.0,4.1,white
1160,NOUVELLE Femmes D'été Col Rond Robe Casual Sans Manches Robe Imprimé Floral Robe Slim Fleur Robe Plus La Taille,6.0,4.0,black & white
1161,Lettre Imprimer Tie Dye Halter Sans Manches Longue Robe D'été Coton Bohème Robe,18.0,2.67,pink
1162,Women Loose - Vestido d'été décontracté et décontracté avec poches à pois à pois au col en V pour femme,8.0,3.8,black
1163,Robe décontractée d'été à manches courtes à manches courtes pour femmes,11.0,3.8,yellow
1164,Femmes été chemise à manches courtes hors épaule lettre imprimer je ne suis pas vieux je suis une chemise en coton classique hauts mode dessin animé voiture chemise,5.0,4.19,white
1165,Pantalon de mode d'été Femmes Leggings Pantalon déchiré Pantalon slim Pantalon vert armée Collants,5.0,4.08,wine
1166,2020 Spring and Summer New Casual Lens Round Neck Cotton Sweater,26.0,4.15,black
1167,Robe sans manches femmes été décontracté imprimé débardeur robe grande taille robe,6.0,3.83,black & yellow
1168,Spring Summer Women Fashion Loose Causal Lace Sleeveless Pure Color  Vest Sexy Loose V Neck Tank Tops for Ladies Plus Size XS-5XL,5.78,3.71,black
1169,2019 Summer Women Plus Size Genou-longueur Sling dress Sans manches Casual Long Dress,5.0,4.13,winered
1170,Short de motard en dentelle noire pour femmes Activewear Summer Athleisure Shorts skinny taille haute femme S-XXL,5.73,3.86,white
1171,Plus la taille des femmes à la mode à manches courtes à lacets Blouses à imprimé floral Tops et t-shirts Casual Summer Lace Stitching Shirts,3.83,3.64,orange
1172,Femmes Mode d'été Leggings Pantalon court Short décontracté Boyfriend Jeans Solid Slim Fit Hot Shorts Plus Size S-5XL,7.0,3.69,navyblue
1173,3 Couleur Été Nouvelles Femmes De Mode Sexy Déchiré Skinny Denim Pantalon Court Short Décontracté Hot Jeans Plus La Taille Femmes Pantalon S-3XL,15.0,4.11,lightblue
1174,2019 Mode d'été pour dames - Pantalon à lacets à lacets - Pantalon court à taille haute décontractée - Taille décontractée (S-5XL),3.92,3.76,black
1175,Femmes Mode D'été Col En V Camisole Gilet Couleur Unie Tops Sans Manches T-shirt Lâche Casual Plus La Taille Débardeurs,11.0,3.43,white
1176,Women Summer Sleeveless Irregular Hem Dress Maxi Dress Plus Size Hippie Soul Letter Printed Beach Long Dress 5 Colors,6.0,4.75,green
1177,Femmes Salopette D'été Bavoir Pantalon Shorts Casual Lâche Sans Manches Barboteuses Salopette Bretelles Salopette XS-XXXL,2.65,3.4,orange
1178,Femmes D'été Nouvelle Mode Shorts De Sport Couleur Unie Élastique Shorts Femelle Slim Fit Running Pantalon Court Gym Workout Élastique Casual Sport Pantalon Court,3.71,3.44,purple
1179,Nouvelle Mode Femmes Sans Manches Couleur Unie Spaghetti Strap Package Hip Dress Casual Slim Fit Mini Robe Party Dress Summer Street Dress 5 Couleurs S-5XL,13.0,3.78,beige
1180,Combinaisons Été Style Simple Femmes Combinaison À Manches Courtes Jambe Large Couleur Unie Vêtements D'affaires,12.0,3.59,black
1181,Aowofs Salopette d'été en coton pour homme Camouflage d'été Shorts amples,13.0,3.91,black
1182,"Robe longue à rayures Boho Mère et Fille Mère et Fille, assortie à l'ensemble pour maman et enfants",12.0,4.09,black
1183,Crop top d'été à imprimé squelette pour femme,5.69,4.31,white
1184,Été lâche grande taille imprimé femmes sans manches robe gâteau jupe,6.0,3.79,purple
1185,Été nouvelle mode femmes deux pièces vêtements de nuit en soie douce ensembles de pyjama occasionnels (6 couleurs) ,11.0,4.1,red
1186,Women's Fashion Summer Sexy Lace Bandage Shirt Top Solid Color Sleeveless Slim Top,5.0,3.75,pink
1187,2019 Mode d'été Femme sans manches Débardeur en dentelle Débardeur Spaghetti Strap Tops Débardeur décontracté Débardeur V Chemise col V Grande taille,7.0,3.19,armygreen
1188,NOUVEAU Mode Femmes Vintage Rayé Vertical Mini Bouton Sexy Cami Robes De Printemps Et D'été,11.0,3.56,black
1189,Nouvelle mode d'été femmes robe décontractée col rond lâche Big Swing jupe sans manches Soild couleur robe de plage,5.65,2.86,black
1190,Robe de plage d'été décontractée à manches courtes et manches longues en coton plissé à encolure en V profond avec poches Mini robe ample en coton plissé,5.85,3.55,black
1191,Maillot de bain deux pièces femme Bikini Cut Flower Pushups Maillots de bain Beachwear,8.0,4.11,blue
1192,XS-8XL Plus Size Summer Women Casual Solid Color Loose Sleeveless Beach Tank Top Dress Deep V-neck Short Club Party Mini Halter Robes Mini Halter Robes aux genoux Jupes plissées Dames Swing Fashion Robe en coton,6.0,4.13,navyblue
1193,Robe à bretelles d'été col en V à bretelles florales Robe décontractée à grande poche,11.0,3.96,white & green
1194,Côté Split Lettre Imprimer Ourlet Incurvé Robe Décontractée Style Sport D'été T-shirt Robe Plus La Taille,14.0,4.12,white
1195,New Summer Women's New Fashion Sleeveless Polka Dot V-neck Strap Mini Backless Casual Top Dresses,3.68,3.71,navy
1196,2019 Mode Femmes Été Col En V Sans Manches Recueillir Taille Boho Imprimer Maxi Robe Longue S-XXXXXL,18.0,3.56,green
1197,NOUVELLE Mode D'été Femmes Dames Maxi Robes Sans Manches Décontracté Col En V Gradient Couleur Plage Robe Longue Couleur Unie Soirée Soirée Plus La Taille S-5XL,5.0,3.32,pink
1198,2020 5 Couleur Été Nouvelle Mode Femmes Tops Blouse Plus La Taille Sans Manches Bretelles Débardeurs Cross Back Tops Été Causal Tops pour Femmes S-5XL,7.0,4.24,red
1199,S-5XL Summer Women Casual Tops Off Shoulder Fashion Female T Shirt Plus Size Blouse,8.0,4.14,black
1200,Juice-Wrld Letter Printed Crop Top And Shorts Set Summer Short Sleeve Crop Top And Elastic Beach Shorts Casual Two Pieces,16.0,3.72,offblack
1201,XS-8XL T-shirts décontractés d'été XS-8XL T-shirts décontractés d'été pour femmes Chemisiers grande taille à manches courtes avec surpiqûres creuses Chemisiers en dentelle Couleur bonbon Couleur bonbon Relâche Cou en O Couleur uni Surdimensionné Tops,5.74,3.9,green
1202,Legging Capri femme en jean 3/4 Legging d'été Jegging Pantalon skinny imprimé papillon,8.0,3.71,blue
1203,2019 nouveau mode d'été sans manches en dentelle patchwork débardeur ourlet irrégulier Cami débardeur,8.0,3.63,black
1204,Summer Fashion Women Casual Solid One-shoulder Vest Slim Fit Sleeveless Top Hole Sports Shirts,3.0,3.9,grey
1205,Mini robe de soirée décontractée sans manches pour femmes,2.89,5.0,green
1206,"Pantalon à lacets à la mode pour femmes d'été, plus la taille Pantalon court à taille haute décontracté",2.0,3.32,red
1207,Pnma Hommes Été À Séchage Rapide Shorts Hommes Swim Beach Shorts Shim Shorts Beach Wear Sports Gym,9.0,3.7,red
1208,Robe d'été sans manches imprimée sans bretelles pour femme,9.0,5.0,white
1209,Femmes d'été Sling Dress V-cou Floral Strap plissé Casual Pocket Large Dress,11.0,4.03,white & green
1210,Mode féminine Maillots de bain Deux pièces Split Bikini Set Summer Printed Beach Bathing Swimsuits,9.0,4.2,red
1211,Dames d'été Tie Dye Imprimer manches courtes hors épaule Casual Plus Size Dress,4.8100000000000005,5.0,yellow
1212,"Robe à manches courtes d'été Femmes Robe lâche décontractée, Plus la taille Robe à col en V à fleurs",8.0,3.8,blue
1213,2018 Femmes d'été Femmes Sexy Off Shoulder Shirt Casual Half Sleeve Top Ladies Fashion Printing Loose T-shirts Plus Grande Taille Blouse en coton Blouse XS-5XL,8.0,4.17,blue
1214,XS-8XL Plus La Taille Vêtements De Mode Robes D'été Femmes Casual Robe De Plage Sans Manches Dégradé Couleur Robe En Coton Col En V Profond Épaule Longue Robe Dames Lâche Halter Robe De Soirée,5.0,2.98,pink
1215,"Summer Beach Safety Shorts Leggings Lady Leggings Pantalon en dentelle sans couture Mode Femme (3 couleurs, S-6XL)",6.0,3.98,black
1216,Women's Ten Colors Pure Color Dress Robe Robe d'été à manches courtes Tunic S-XXL Robes pour femmes,13.0,4.14,black
1217,Mini robe de soirée décontractée sans manches pour femmes,2.89,5.0,green
1218,Été Femmes À Manches Courtes Casual Sans Manches Rayure T-shirts Robe Tunique Taille Robes Plage Robe Plus La Taille XS-8XL,11.0,3.97,red
1219,Mode féminine Printemps et été O-cou T-shirt en coton Chemisier imprimé lâche Casual Tops à manches courtes Dames Mode Chemise grande taille,5.0,4.13,winered
1220,2020 Été Sexy Femmes Halter Tops Plage De Natation Lettre Imprimer Maillots De Bain Lady Push Up Gilet Soutien-Gorge S-5XL,7.0,3.6,black
1221,Été nouvelle mode femmes glace robe de nuit en soie soie sexy dentelle robe de nuit (11 couleurs),9.0,4.24,violet
1222,Nouvelle mode femmes lâche col rond robe manches courtes couleur unie tenue décontractée,12.0,3.6,black
1223,Femmes Mode Lâche Casual Sans Manches Imprimé Floral Col Rond Tops Gilet D'été Camisole Casual Plus La Taille Lâche Débardeurs,5.75,3.67,yellow
1224,Femmes été décontracté lâche couleur unie salopette vintage sangle pantalon long combinaisons barboteuses grande taille,11.0,2.92,winered
1225,Femmes sans bretelles ruché Tube Top Shirt Backless Stretchy Tunic Shirt pour les femmes,11.0,4.15,black
1226,"Robe d'été à taille genou pour femmes, taille plus, sans manches, robe longue décontractée",11.0,4.39,armygreen
1227,Mode d'été Femmes Dos Nu Sangle Siamois Floral Imprimé Pantalon Profond Col En V Cordon Cordon Coton Combinaison Sans Manches Combinaison Femme,7.0,3.83,black
1228,Mode féminine d'été T-shirt à manches courtes Dames Femme Col en V Évider Chemisier lâche décontracté Plus la taille Tops,1.72,3.77,fluorescentgreen
1229,NOUVEAU Mode féminine d'été Shorts lâches Taille élastique Pantalon court Shorts décontractés,2.9,3.89,black
1230,'Let That Shit Go' Femmes Graphic Tee Casual Cotton T-shirts manches courtes Bohemia Style Mandala Namaste Printed Top Blouse,8.0,3.95,winered
1231,Nouveau mode d'été v-cou coeur T-shirt O cou à manches longues Top femmes mignon T-shirt amusant plus la taille,2.81,3.64,purple
1232,Chaussettes basses pour hommes Chaussettes invisibles peu profondes Printemps et été Chaussettes courtes Pur coton Chaussettes respirantes Medias Femininas Chaussettes pour hommes,2.0,4.15,white
1233,Femmes d'été Sling Dress V-cou Floral Strap plissé Casual Pocket Large Dress,8.0,4.2,white & green
1234,Femmes Causal À Manches Courtes Oeil Lèvre Imprimer Graphique T-shirts Plus La Taille Col En V Plus La Taille T-shirts Tops Mode Mignon Drôle Chemisier Chemises,5.86,4.06,pink
1235,Women's Round Neck Digital Flower Printed Dress Sleeveless Plus Size Mini Robe Robe,11.0,3.95,rosered
1236,Papillon Imprimer Coton Masque Visage Sport En Plein Air Rencontrez Masque D'isolement D'été Nouvelle Mode À La Mode Masque De Rue Casual Bandana pour les Femmes Soins de Santé,2.67,5.0,purple
1237,"2019 été nouvelle mode féminine ""Let It ~"" Bee '' imprimé décontracté col rond graphique T-shirt mignon à manches courtes en coton T-shirts",11.0,4.05,black
1238,Bikini Bikini Femme Bandage Push Up Maillots de bain Dentelle Maillot de bain une pièce Maillot de bain de bain une pièce,13.0,3.79,black
1239,Nouvelle mode d'été femmes robe décontractée col rond lâche Big Swing jupe sans manches Soild couleur robe de plage,5.65,2.86,black
1240,Femmes été spaghetti sangle hors épaule sans manches surdimensionné couleur unie robe Vintage volants soirée soirée grande taille robe réglable bretelles A-ligne robe patineuse plissée robe avec bouton,8.0,4.04,purple
1241,ZANZEA Femmes Été Floral Imprimé Vintage Robe Midi Décontractée Robe Lâche,14.0,4.18,yellow
1242,"Femmes lâche décontracté imprimé col en V robe longue, plus la taille vague point robe robe d'été",11.0,3.38,white
1243,Mode d'été pour dames d'été casual débardeur veste veste blouse chemise sans manches haut court chemise courte,7.0,3.98,black
1244,Mode d'été Femme Sexy Gilet Imprimé Numérique Irrégulier sans manches S-XXXXXXXL,11.0,3.86,multicolor
1245,T-shirt Suzuki Motocycles pour hommes Tops décontractés à manches courtes,9.0,3.92,red
1246,Maillot de bain Maillot de bain Monokini une pièce pour femme Bikini rembourré Push Up Swimsuit Bathing Monokini HOT,8.0,4.19,black
1247,Femmes d'été à manches courtes en coton T-shirts Tops Casual col rond Imprimer Pull Plus Size Blouses,8.0,4.39,blue
1248,Robe d'été décontractée à manches courtes pour femmes,11.0,3.65,black
1249,Costume de sport cool pour hommes d'été Vêtements de sport Costumes de jogging décontractés Ensembles de tenues à manches courtes,15.0,4.4,green
1250,Séchage rapide 2 pièces ensemble homme décontracté vêtements mode d'été hommes fitness costume costumes de sport à manches courtes T-shirt + Shorts,16.0,3.44,black
1251,Débardeurs en mousseline de soie en soie pour femmes d'été Lâche Col en V Couleur unie Sling Vest Débardeur,5.0,2.94,white
1252,Mode féminine d'été sans manches col en V crâne mini-robes imprimées,13.0,4.11,brown
1253,2020 Hommes Marque De Mode D'été Costumes D'été Casual Athlétique Ensemble Survêtements À Manches Courtes,20.0,3.2,green
1254,2020 Women Ladies Fashion Plus Size Summer Tie Dye Print Short Sleeve One Shoulder Casual  Dress,16.0,3.73,yellow
1255,Nouvelle mode d'été femmes robe décontractée col rond lâche Big Swing jupe sans manches Soild couleur robe de plage,1.0,3.56,white
1256,2018 Dames Femmes Mode Mode Dames Robe d'été au crochet en dentelle Robe d'été Robe longue Robe longue en dentelle,9.0,3.31,white
1257,Maillot de bain femme Maillot de bain Maillot de bain Bikini Tankini Beachwear Plus Size XS-8XL,14.0,4.26,multicolor
1258,T-shirt décontracté à manches courtes pour femmes,6.0,5.0,white
1259,Mode féminine Lâche Casual Imprimé floral Col en V Multicolore Robe d'été Robe sans manches,7.0,2.75,yellow
1260,T-shirt de mode pour femmes d'été 4 couleurs O-Neck Casual Top Coconut Tree Sunset Apportez le soleil Impression de lettres à manches courtes Solid Plus Size S-5XL,11.0,3.91,green
1261,Mode féminine d'été T-shirt à manches courtes Dames Femme Col en V Évider Chemisier lâche décontracté Plus la taille Tops,1.72,3.77,fluorescentgreen
1262,Nouveau Sexy Femmes Bandage Découpé Débardeurs Dames D'été Bustier Crop Tops Une Taille,5.67,3.63,white
1263,Été Sexy Femmes Mode Casual Lâche Tops Casual T-Shirt D'été Col En V Solide Couleur Plus La Taille À Manches Courtes Blouse,6.0,3.31,lightblue
1264,Be Happy T-shirt T-shirt en coton à manches courtes pour femmes,6.0,4.31,black
1265,ZANZEA Robe torche à manches en V pour femme Robe en dentelle Robe chemise en lin de coton,12.0,4.11,navy
1266,S-5XL Women Sleeveless Spaghetti Strap Long Dresses Summer Beach Tank Top Dress Sundress Kleid,11.0,3.61,black
1267,Été amélioré portable mini-cou suspendu ventilateur rechargeable USB tour de cou ventilateur pour Voyage en plein air bureau à domicile ventilateur,12.0,4.17,white
1268,Femmes Bohême Style col V manches manches longues imprimé floral Mini Robe débardeur décontractée,11.0,3.58,navyblue
1269,Pandolah Taille Haute Femme Ensemble Bikini Taille Plus Taille Plus Maillot de bain à pompons matelassés Super sexy,8.0,3.76,black
1270,Mode féminine taille haute Elstic Shorts Summer Casual Shorts Gym Shorts,5.0,3.7,green
1271,XS-8XL Plus Size Fashion Dresses Summer Clothes Women's Casual Short Sleeve Dress Solid Color Beach Wear Dress with Pockets Deep V-neck Pleated Cotton Mini Dress Loose Party Dress,4.0,4.5,pink
1272,2018 Nouveau Le nouveau maillot de bain LBT en maillot de bain Maillot de bain LBT en maillot de bain national à coupe transversale,11.0,3.28,black
1273,2020 Summer Funny Pop Two Piece Set Summer Harajuku Cotton Print Crop Top T Shirt and Shorts XXL,12.0,4.24,pink & black
1274,"Femmes Casual manches courtes Baggy coton lin Maxi Dress géométrique épissage robes irrégulières, plus la taille XS-5XL",11.0,3.26,red
1275,Women's Summer Fashion Spaghetti Strap Dress Floral Print Tie Front Mini Dress Sexy Dress Plus Size S-5XL,8.0,3.88,yellow
1276,Maillot de bain femme maillot de bain Bikinis Halter Maillots de bain femme Maillot de bain maillot de bain Tankini Monokini,7.0,3.85,black & blue
1277,2020 femmes mode bandage maillots de bain ensembles de bikini colorblock beachwear,8.0,3.87,red
1278,Nouvelle arrivée femmes mode une épaule je ne suis pas vieux je suis classique graphique demi-manches T-shirts drôle lettre imprimé anniversaire été hauts,1.88,4.46,white
